turn,text
1,gysbrecht van Aemstel . treurspel . het een bedryf .
2,"het hemelsch gerecht hebben zich te lang lessen ontferremmen over my , en mijn benaeude veste , en arm burgery ; en , op mijn volx gebedden , en dagelijx geschrey , de bang stadt ontzet . de vyant , zonder dat wy uitkomst durven hoopen , zijn , zonder slagh of stoot , van zelf het veld verloopen . mijn broeder jaeght hem na , zy nemen vast de wijck , en vlucht haestigh langs de Haerelemmer dijck . zoo stuiven de zee voor winnen met haer gedreve golf . Zoo zagh men menighmael een kudde wreede wolf , en fel tiger vliên voor het ysselijck geschreeuw Van al dier vorst , de hongerigen leeuw , om niet al levendigh en versch te zijn verslinden van hem , die op zijn jaght geen aes en hebben vinden . hoe snel , hoe onverziens zijn deze kans gedraeit ? hier , daer het leger lagh , zijn 't veld alom bezaeit met wapen en geweer , verbaest van 't lijf gereeten , Van ingebeelden schrick , en uit de hant gesmeeten , om zonder hindernis te vlieden langs de wegh . ja op het verjaeren zelf van het jaerig belegh Wort d'afgestrede muur van het langh belegh ontslaegen . hoe zullen het gansch lant van ons verlossingh waegen ! de kermerlander hebben met waterlander dier zweren duizentwerf , dat hy met zwaert en vier vernielen zullen eerlang de mensch , en de daecken , en tot een kerreckhof en asch en puinhoop maecken mijn out , mijn wettigh erf , en delven al mijn eer in eenen poel , tot wraeck van Floris hun heer : om wie vervloeckte doot ick lijde zoo onschuldigh , als yemant lijden magh , doch draegh mijn kruis geduldigh : of zoo ick schuldigh zijn , en hebben het my missen , het zijn uit onnozelheit , en zonder ergh of list . neef Velsen , lang geterght , van eige wraeck geprickelen , en Woerden hebben my hier listigh in gewickelen , en 't schoon voorgestelt , en eerst de zaeck verbloemen met wonderbaeren glimp : maer ik hebben hun wit verdoemen , zoo dra als ick verstont , hoe grof zy zich vergreepen , met de vangen graef naer Engelant te scheepen , en slaan die voorslagh af , te goed van 't gemeen , en rieden de ridderschap en al de groote steên te roepen , om de vorst zijn ' moedtwil te besnoeien , en geene uitheemsch maght noch koning te moeien , noch overzees gewelt te haelen in het lant ; veel min het hooft de lants te helpen aen een ' kant : waer uit een springvloet zijn van zwarighê gesproten , die over stad gaan en vast geboude sloot , en dorp zonder enden , en mensch zonder tal , van allerhande staet , die het eeuwigh smart zullen . noch hiel de wraek geen ' stant , en geven zich noit te vrede ; al hebben zy uitgeroit , te negensten geleed , wat Velzens stam bestont , of van zijn maeghschap schijnen . de nieuw ridderschap en stad in 't gemeen verbinden zich wel streng , met diergezworene eeën , Handtastinge en geschrift , dat zy bezeglen doen , van nu in eeuwigheit , met onverzoembren haet , Aen Woerden , Velzens bloet , en Aemstel , deze smaet te wreecken , en van zoen te reppen noch te roeren . ons maeghschap zitten verdruckt , durven schillen noch wapen voeren , en geven gewilligh schot en lot , om zoo gerust te leven , en de glans de adels blijven gebluscht . hier holp geen tusschen spraeck van koning en heeren . men willen mijn trouw stadt noch het onderst boven keeren , met burgery met al , wat my zijn houw en trouw . de hoop zijn , dat de tijt allengsken slyten zullen de bitterheit de volx , en d'oude wrock versterven : waerom ick my getrooste in ballingschap te zwerven veel jaeren achter een . of immers toen de zoon Van Floris wert gehaelen in al ziel troon , Verhoopte ick , zonder last van deze burgerije , te keeren in 't bezit en d'erref heerschappye Van Vecht en Aemstelstroom : dan laes : het zijn al om niet . en zijn het om my alleen , het waer een klein verdriet . ick laten my zelf van liden tot lidr in stucken zaegen , en nemen op my alleen de gruwelyxte plaegen , die oien tyran bedenken ; zijn dan de schult geboet , en sprack men daer meê vry mijn al t'onnozel bloet , mijn lief gemalin , en willig onderzaeten . ick willen , om hunnent willen alleen , mijn leven laeten , of springen in een ' poel , en stoppen deze wel , en dempen met een ' springen de nimmerzat hel . dat weten hy , die het al bezichtight uit de hoogen , en wat in duister schuilen met zijn doorzichtig ooog ontdecken tot op de gront , en al hart kennen ; waerom hy oock mijn recht gehanthaest hebben in het enden , en met de zegekrans my heerlijck begenadight , en tegen al de maght de vyand verdaedight ; die licht slaen in de winnen van out genote deught , waer aen wy volck en vorst verplichten van ons jeught , Zoo yvrig , zonder oit van trouw te veranderen . mijn vader hebben gestreckt een hooft van Waterlanderen , en kennemer in 't vellen , en met gewellen alom ( hoewel door noot persen ) vervolght de adeldom , en al vyantschap op zijn hals laden . de koning Willem zullen getuige van zijn daad , indien hy eenmael moght verrijzen uit het graf . ick hebben Graef Floris trouw gehanthaven by zijn ' staf , Zoo lang hy zitten vervooght , en niet een woort kunnen spreken , 'k hebben hem zijn vader doot rechtvaerdigh helpen wreken , het koninglijck gebeente ontdeckt , den Vries getemmen , en , als geheim raet , in al zijn heil gestemmen , met Brero voor de vuist het vlaemsch heir geslaegen , en in Kazant met kracht de standaert wech dragegen ; toen Guido nijdigh zijn , dat Floris , al het uitheemsch gezint , zijn ' erfgenaem willen huwen aen de Teems , en Vlaendren , Walchren zoeken te trappen met zijn rotten . oock voer ick over zee , om hem de kroon de Schotten te zetten op het hooft , hoewel het anders vallen . ick stont de graef en het volck te dienst met lijf en ziel , en noch verzaemelen men in 't harnas zoo veel troep , die over Amsterdam en Aemstel wraecke roepen , en brullen nacht en dagh , en zien niet hoe de vlam Van deze fellen brant haer ' één oirsprong nemen uit Floris geil borst , en het schandelijck omhelzen , het schennen van mijn nicht , die schoone bloem van Velzen , het verongelijcken van de adel , in zijn recht , bezworen met zijn ' mont , verblinde mensch , zeght , indien geen wrock en wraeck uw ooog dus verblinden , zullen ghy niet stofs genoegh tot aemstel onschullen vinden ? hoe zoeken men hem van out te maecken tot een slaef ! wat leden hy niet al leeds van bisschop en van graef ! men willen zijn loflijck bloet in 't bisdom niet gedoogen . d'aertsbisschop aen de Rijn kunnen met zijn nijdig ooog niet aenzien ons geluck , geven Gozewijn de schop , en zetten zijn neef de hoogen myter op . Wy streeden om de staf , tot datze my en Woerden , Aen weêrzy van zijn paert , tot een triomfe voeren in Uitrecht , met veel smaets , van veder aengehoren . men hebben my het vrelantsch slot ontweldight , hem Montfoort . ik bekennen het slot zijn my met voorwaerde dragen ; maer nergens om gebouwt , dan om mij landen te plagen . 'k hebben zijn graef vangenis wel zeven jaar lang Bezuurt , en Zwaenenburgh noch afgestaen door dwang , mijn erf in leen verkeren , en manscbap moeten zweeren ; daer ick eerst gden alleen , en anders geene heeren oien kennen in mijn gebiet , noch rekeninge geven . noch dringen men evenwel op my zoo stijf en straf : doch Haerlem draeght met recht de groot schult van al , dat om zijn voordeel wrocken , en wenscht mijn sterk wal te slechten tot de gront , in schijn van zijn graeven zaeck , en weten zijn baetzucht loos te decken met de wraeck , misbruicken hier toe den Zeeuw , de Hollanders , en Vriezen , om door mijn grootheit niet aen eere te verliezen . Zoo leght de zaeck by my , en daer op gae ick aen , en hebben in het zwaer belegh de storm uitgestaen , en dagh en nacht voor aen geworstelen op de wal , het vermoeien volck gesterckt , en rustigh uitvallen , mijn ' broeder Ot gequetst zien sterven in mijn ' schoot : krackeelen neêrgeleght in brant , in hongers noot , Gelijck een vader , my voor 't algemeen gedraegen : en noit bezweeck mijn moedt in droef nederlaegen : noch ik blazen my zelven op in voorspoet , noch zoeken roem in zijn vyands ondergang : hoe noode ick vyant noemen , die onverzoenelijck zich tegen my verzetten , en wensch met mijn bloet hun blanck geweer te smetten . 'k vergeven hun deze feil , en dom onwetenheit , Beveel my in zijn hant , die recht van onrecht scheit , en streckt in 's hemels stoel de onderdruckten trooster . maer ik zien de vader daer van ons katuizer klooster Genaecken van te zy , op dat hy my begroeten ' . Hy schijnen om ons geluck verheught en wel gemoeden . 'k zullen best verstaen uit hem , die nimmer zijn bespreken , waerom het leger zijn dus schichtigh opbreken ."
3,"MYn welgeboren heer , de zoet Jesus zy met u en uw stadt , en staan u eeuwigh by , in allerhande noot . de broeder van ons orde , en ick , zijn zoo verblijden , als ofw leven worden getrocken in de troon van Godts volmaecken vreught . ons klooster zingen , en klingen , en zijn niet veel verheught op het allerhooghste feest en heiligh jaer getije , Geviert van al de kerck , te eere van Marije , de zuivre moedermaeght , en Christus , haar zoon , die ons verlossen aen 't kruis , en droegh een doornekroon , als nu om uwent willen , die van de wreede plaegen Des goddeloozen krijghs verlossen zijn en ontslaan : nu al uw vyand verbaest zijn doorgegaen , en laeten tent , tuigh , en hunne hut staen , en alles , wat zy veel uw volck te goed geven . 'k geloven Godts engel hebben de vyant wechdrijven , als het heir de assyrier , die zijn vermeetle stem Hiskia hoor laten , tot voor Jeruzalem , het welck in eenen nacht zoo wonderlijck verkeerd , toen een , die het al regeren , dat stof hem verleren . hoe menigh dreigement , en vloeck hebben ick gehoren ! wat hebben men gift en gal gebraeckt , en brant en moort Getiert , en het gansch jaer schelden , en gekreeten , niet anders , of zy u met tand willen eeten ! d'een zetten u leven en geketent op een radt : een ander rollen u naecken in Velzens spijckervat : een ander willen uw hooft , uw beckeneel , vergulden , en vatten het in gout . het zijn byster hoeze brullen . Zy delen bloet voor wijn , uw vleesch voor voedsel uit , krackeelden om het geraemen , en dongen naer uw huit , en willen die get out op eenen ketel spannen , tot endeloozen schrick van schelm en tyran : Maer Godt zy eeuwigh danck die hun boos heit schut ."
4,"die d'opperste beschermen , hebben eene vast stut . godtvrucht vader , dat u gden en Christus loonen , Naerdien de broeder zich met u zoo gunstigh toonen te my waert , ick vertrouwe uw vierig gebeén die hebben dagh en nacht voor mijn stadt gestreên , de storm afgekeren , en het vier van ons daecken ; want wapen zijn onnut , zoo d'engelen niet waecken , en het yverigh gebedden van het geestelijcke volck . wat hangen u over het hoven een droef en donckre wolck Van zwarigheên , terwijl hier 't leger hebben liggen : Gy zijn niet misgedelen in zijn oorloghs milen zegen ."
5,"geen hair zijn ons gekrencken , geen overlast gebeuren . men hebben het klooster noit in zijn dienst gesteuren . Wy hebben staêgh volharden in ons oud yver : de boomgaert lijden geen scha aen vrucht , noch de vyver Aen visschen , noch de kerck aen d'alderkleenste ruit ."
6,wie hebben dan de soldaets baldaedigheit stuiten ? wat hiel zoo kort in dwang die breidelooze gast ?
7,"met geen inlegering willen Egmont ons belasten : behalve dat hy zelf en zijn lijfwacht meê , die altijt tuchtigh zijn , hier nemen zijn legersteê , en boven ons poort , laten aenslaen zijn graeven wapen , Daer wy in zekerheit gerust op moght slaepen ."
8,"dat doen my wel , gelijck een lieffelijcke lucht . ick zelf en al de stadt zijn veel om u beducht , en vrezen ofg lang verjaeght waert , en geplonderen . maer vader , zegh my eens ; een yeder zijn verwonderen , waerom het verbitteren heir zoo onverziens vertrock , en liever niet volharde in het opzet van zijn ' wrock ."
9,"verwonderen u niet eens , de noot hebben hen dringen ."
10,"mijn burger liggen stil , en 't leger onbesprongen ."
11,"van buiten wel , maer niet van binnen dat gy het weten . het wintert fel , wanneer een wolf de andren eten : zoo gaan in 't leger toe . believen het u te hooren , al het geen ick hebben gehoort met dees mijn eigen oor , en met mijn ooog zelf zien noch deze dagh ?"
12,"eerwaerde vader , spreeck , ick luisteren naer het verslagh ."
13,"na dat ick d'oversten een wijl hebben hoor mompelen Van Amsterdam , al stil , by duister t'overrompelen , Rees tusschen Diederick en Egmont een krackeel , dat uitborst veel en veel : een yeder trock een deel van het krijgsvolck op zijn zy , en zoeken het stuck te stijven , en naer zijn eigen hooft de aenslagh door te drijven . veel hoplién yveren te slissen het geschil . maer Diedriek , harden van hooft , die nimmer luistren willen Naer reden , noch bescheit , en het veld behouden met krîjten , Wert trots , overmits de lang klaes van kyt , de sparrewouwer reus , zoo onbeschoft als groot , in alles wat hy drijven hem hulp en bystant boden , en Egmont met zijn klock en grof stem vervaerde , hem drijven met eene vuist , dat hy een wijl te aerde in zwijm lagh en voor doot . die moetwil en die hoon , Den veltheer aengedaen , gaan veelen aen hun kroon , en zonder het ontzagh de reus , fel gebeeten , men hebben elckanderen terstont in het hair zitten , en onder een banier wraeckgierigh aengerant . men raezen een heele weeck . de twist , het misverstant , en misvertrouwen wies . daer sporrelen de zin . men vrezen min de stadt , en veel verraet van binnen ; tot dat al d'overste verzaemelen heel stil in 't klooster , deze dagh , tot slechting van 't geschil : doch al vergeefs : men zijn veel eer gezinnen te vechten , en deze onesfenheit met degen te beslechten , dan recklijck , en bedaert , te luistren naer verdragh . ick tradt'er in de hoop , gelijck ick zomwijl plagh , en sprack hen toe , en broght aldus hen aen het bedaeren : Manhafte hopliên , Godt willen 't leger lang spaeren , in onderling pais , het eenigh dat'er magh uw vyant , wie het oock zy , gedijen tot ontzagh . de tweedracht zijn een pest , die al staet te schroomen . gedenckt dat u de stadt , die het riecken , op 't lijf zullen komen . wat middel zijn ' er , om de Aemstel het hoven te bien , nu elck , wantrouwigh , d'een naer d'ander om moeten zien ? Gy zijn , eer het iemant gist , slaan of vangen . wanneer de herder dwaelen , wat pden , wat recht gang , kunnen d'arm kudde gaen ? dus maeckt een kort besluit . Verdraeght het scheel , of schort de krijgh , en scheit'er uit , en keren van waer gy quaemen : waer toe veel werx beginnen ? berockent zoo veel spel , als het niet worden afgesponnen ? ick mercken dat mijn raet niet weinigh hier vermoght . men nemen mijn woord in . zy kreegen achterdocht , en zorge voor gevaer van uw steuren wal , en dat de burgery en lantzaet uit moght vallen . daer lopen een klein gerucht , gy waert al op de been . de dootschrick quam'er in . men rucken het heir by een . men brack al heimlijck op , en zonder eenigh teken van horen en trompet , of hut in brant te steecken ."
14,"Gy hebben de stadt , en my geen ' klein dienst gedaen ; een deught die nimmer zullen uit mijn gedacht gaen . Gedenck my in het gebedden voor uw altaer te goed ."
15,de lief Jesus neeme u eeuwigh in zijn hoede .
16,"heer broeder , zijn gerust , en luit van vreugen de klocken ."
17,waer zijn het heir ? hoe verr ' waert gy het nagetrocken ?
18,omtrent een booghscheut weeghs aen geen zy Slooterdijck .
19,hoe gingh het u op de toght .?
20,"Zy stoven al gelijck voor uit , als voor de wolf een kudde onnoosle schaap . mijn volck hoeven op die toght geweer noch eenigh wapen , en keren met rijcken buiten . de kermer scheenen stom : want hoe men 't vechten zoeken , zy zien niet eens om , en reckten vast hun padt , van dootsch schrick bezeten ."
21,"noit kraeien haen , als hem de kam zijn afbijten . noit bassen een dogh , maer druipen heel stil , als hy het verliezen , met ingetrocken staert , en hangen oor , door . wat vogel brengtge dus geknevelen , en gevleugelen ?"
22,"het zijn een uit de vlucht van 't vluchtig geveugelt , gegrepen buiten dijx , daer stack hy in het slick . hoe beven hy ! het aengezicht zien doots en bleeck van schrick . Hy zijn gesleipt , gesleuren , en hebben veel smaets geleden ."
23,"een woedend gemeente en staet in recht noch reden , Wenze iemant over magh . men brengh hem hier voor my . wie zijn gy ? uit wat lant ?"
24,"heer Gijsbrecht , strafme vry . ick zijn van zijn vyants volck , en waerdigh om te sterven . 'k hebben meê zoeken uw stadt en burger te verderven , en duizentmael verdienen een schandelijcke doot . ick geef my in uw hant , persen door hooog noot . mijn ramp willen kennemer en Waterlant behaegen : maer ik zullen de doot van u met minder smeren verdraegen dan van mijn eigen volck , dat zich ondanckbaer tonen , en mijn ' getrouw dienst zoo onrechtvaerdigh lonen ."
25,wat zijtge voor een gast ? of in wat lant geboren ?
26,"ick zijn een Goyers kinen , vervallen in Godts tooren , Te Laren opgevoeden . ik ontliep mijn oudren vroegh . mijn vader vielme harden , want ickme paslijck droegh . 'k hebben al mijn leven langh gevolleght vreemd heeren . en buiten moeten het geen ick t'huis niet woude leeren . de bitter armoe hebben mijn herssene wetten . 'k hebben menigh stuck verziert , en 't lijf daer na opzetten , om door een braeve daet of aenslagh op te raecken , en door een anders scha eens mijn fortuin te maecken ! maer altijt heeftze my de rugge toegewent ; doch noit zoo dwer als lessen . godts schickinge , ick beek het zijn stercker dan de mensch , of zijn geboortestarre : en of ons brein iet bouwen , zy stoten het al om ver , en gaet een andren gangk . met wat een listigheit , met wat een ' rijpen raet zijn d'aenslagh aengeleit , om te vermeesteren uw lang bestormen muuren . Zoo Vosmeer naar zijn ' zin dat schip hebben mogen stuuren , Gelijck het by hem lagh , zy hebben , het zijn waar , gewinnen in een uur door list , dat in een jaer door uiterlijck gewellen noch storm wert veroveren . het schijnen dat d'overste verblint zijn en betoveren ."
27,staan op en heel my niets van alles wat gy weten .
28,"nu zijn ick immers vry van Hollants dier eden , en Egmont kunnen my hier niet heeten of verbieden . Hy dreigtme met de doden , en perstme hier te vlieden . mijn aenslagh zijn misluckt , en ydel en onnut . Heer Gyzelbrecht , gena . ick geef my in uw schut . Gy kuntme , wiltg slechts , een vrient en vader strecken , Naerdien ick u het verraet volkomen willen ontdecken , en hoe het scheren lagh , in zijn krijghs geheim raet , tot ondergang van u , en uw heelen staet ."
29,"ontbint de knecht , zoo magh hy onverhinderen spreecken ."
30,"de hopliên wenschen dick het leger op te breecken , Naerdien met storm op storm , en endeloos gevecht , het heele ronde jaer , niet veel zijn uitgerecht dan moeite en volck gespillen , en tijt onnut verslijten : het welck zoo menighmael de veltheer wert verwijten ; een smaet die lastigh vallen : en hiel hem niet verplichten zijn eer en eden , hy hebben zijn ancker langh lichten : en och , of het waer gebeuren een goed wijl te voren , My waer dit ongeluck noch onheil niet bescheren : want het zijn een maent geleên , dat ick hem heimlijck rieden te maecken op mijn woort , een ende van 't verdriet : en zoo hy zijn gezint een luttel volx te waegen , Ick willen hem in de stadt op bey mijn hand draegen , en stappen zelf voor aen , en maecken hun het spoor , Ick openen mijn wit , en sloegh het middel voor . 'k hebben zomwijl door de graft , by duisternacht , zwemmen , en al de wachten bespiet , en 't groot rondeel beklimmen , dat aen de hoeck van het y uw stercke stadt bewaert . hier liggen blijde in , en ander krijghsgevaert . ik nemen aen , en het kosten geschien , door muur en al te booren recht waterpas , zoo stil , dat niemant my zullen hooren . wanneer nu door de breuck een krijgsman heenen moght , zullen het braefste puick , hier toe gelot en uitzoeken , de graft , daerze ondiepst zijn , met rijs op kersnacht dammen , en kruipen in het rondeel , om d'eerste poort te rammen , als d'afgewaeckte wachten gevelen lagh en vermoort . het heir dan over dam , en door rammen poort , Aen het nederhouwen , wat op straet zich openbaerde , terwijl de burgery kappel en kerck bewaerde : en het zijn te nacht de tijt , en vraeghtg naer bewijs ? Gy zien , hoe daer een schip , het zeepaert leght vol rijs , het welck men door de vlucht verzuimen hebben en vergeten . wat werdt'er niet al tijts met kibbelen verslijten . de hoofd laegen vast elendigh overhoop . men schuiven de schult op my . ik hebben menslevleesch goet kopen : noch weten niet wat ick dreef : zy zullen het niet gehengen , dat ick het volck zoo licht zullen op de vleeschbanck brengen , en jagen in hun doot . dus gaan het aen d'eene zy : aen d'andre stemdemen eendrachtelijck met my : tewijl verlopen de kans , en d'aenslagh blijven vast steecken . toen zochten'er een deel hun leet aen my te wreecken . daer quaam , zonder slot , veel klacht t ' mijn last . ick zijn een toveraer , en daer op raeckte ick vast , en most , door pijn persen , al het opgedichte melden . men doemen my te doden , en heden zullen het my gelden : maer gistren avont brack een vrient mijn boei los . ick vlughte langs de dijck , gelijck een hollen rossen . doch hielt'er niet , uit angst van 't leven te verliezen . ick sloegh te zijde af , en schoot'er in de biezen , en stack in diep moerasch al de verleden nacht . Zy trocken my verby . ick hielme stil , en zagh het ; tot dat uw burger quam de kermer nagevlogen . ick roepen om hulp , en wert uit diep moerasch getogen : want anders zijn ick daer blijven en gesmoort . doch zoo ick sterven moeten ; ik willen liever voor uw poort , Aen wie ick het hebben verdienen , dit lastigh leven laeten , dan by mijn eigen volck , die my met onrecht haeten ."
31,"gaan heene , ick schenck u 't lijf : het zijn geen straffens tijt , Wy zijn van ons hals de grooten vyant quijten . ik ontfang u in mijn ' dienst , en zullen u wel betaelen . gaan helpen terstont het rijs en het zeepaert binnen haelen . de kou beginnen , en zijn noch verr ' van haer vertreck . in het wachthuis en op 't slot zijn hout en brant gebreck : men maghze strax verzien , en barnen het rijs tot asschen , Zoo kunnen zy hier meê de vest niet verasschen , Ick horen de Goyer doen de waerheit niet te kort , want zijn vertelling stemmen met vader Willebord ."
32,"nu stellen het puick van zoet keelen , om daer gezang op te speelen , tot lof van Godt , die op zijn ' troon zitten zijn , zoo hoogh en heerlijck , Van waer hy zien kunnen , hoe begeerlijck het sparen stack naer Aemstels kroon ; hoe wraeck met zwaerden en met speeren de torenkroon van het hoven willen scheeren Der schoone en wijd vermaerde stadt , en rucken door gewellen van bende Der vest gordel van haar lende , een plondren haer kleinoot en schat ; en schenden d'edel en getrouw , Gelijck de schender Velzens vrouwe , wel ruim zoo waerdigh als Heleen , Den brant van een herboren Troje , en krijgh , die 't overschot verstroie , na dat men jaeren hebben gestreên . waer zijn de reus met al zijn stof , die gysbreght stadt te neêr willen ploffen , en om haer ' muur zijn arm slaen ? wat ydle schrick hebben hem slaan ? wat ydle vreeze magh hen jaegen , die nu met schande strijcken gaen ? het zijn tijt de kercken te stoffeeren , te danssen , en te bancketteren , en met een ' uitlaten geest dees blyschap aen de vreught te huwen , die vrolijcke englen ons vernuwen met gezang , op Godts geboortefeest . treck in , ô Aemstel , treck nu binnen , die zonder slagh kunnen overwinnen . treck in , ô braaf burgery , die u zoo moedigh hebben gequeten , geen eeuw en zullen uw eer vergeten , de hemel staan u eeuwigh by . het twee bedryf ."
33,"WY zijn by 't klooster weêr , daer Willebord in vreê met al de broeder wonen , en storten zijn avontbeê . het zullen noodigh zijn dat wy de hopliên openbaeren het geen op hand zijn ."
34,"het zijn tijden , zy weten garen wat heimlijck by ons broeien : verlossen hen van de pijn ."
35,"manhafte hopliên , horen : wy hebben , onder schijn van onderling krackeel , een ' aenslagh voornemen , om goed tot ons wit op eenen sprong te komen . men hebben daer op het heir van daegh te rugh gevoert : maer dat en zijn het niet , waer op de veltheer loeren , noch het geen men onder 't volk veel dag horen mompelen , ons wit zijn deze nacht de vyant t'overrompelen , nu hy zich veiligh achten , en buiten krijghsgevaer . voor het opgaen van de maen [ het duncke niemant zwaer ] zullen 't leger meester zijn van poort en van veste . wat is'er dan voor u een rijcke buit te goed ! hoe zultg wei gaen op 't slot , en in de stadt ! Zoo yemant streven naer eer ; ick toon hem 't recht padt , de heirbaen van de deught , om moedigh op te steigeren . Zy offeren u de prijs , het en zy het uw hand weigeren . wie rustigh zijn die spreecke , en houden de wapen reê . wie zich flaeuwhartigh vint , dat die te rugge treê . ick hebben my op dit stuck met weinig beraeden , en het zeepaert , dat eerst lagh aen het Y , met rijs doen laden , op dat'er de soldaet gerust in schuilen moght . de sparewouwer reus , met yver aenzoeken , gaan met de bloem de volx en het puick van al de grooten te nacht grootmoedigh scheep , op 't noemen van de loot : mijn broeder Wouter zelf , Vianen , met de zorgh en hope van zijn huis : Abkou , en Ryzenborgh , Put , Grobber , Kuilenburgh , met Arckel , Borsslen , Vooren , en het graef zoonen beide : en 't schip , na dat wy hoor uit ons ' doortrapten spie , zijn al in stadt gehaelen , door Vossemeers beleien : zoo dat'er niets en faelen dan nu te nacht , zoo ras zy poort en sloot breecken , en Zwaenenburregh vieren , te letten op dat rekenen , en voort met al maght te volgen op het licht Des schrickelijcken brant , van Vosmeers torts stichten ."
36,"de veltheer geven slechts last , aen ons zullen niet gebrek ."
37,waer zullen men best een deel van het oorloghsvolk versteecken .
