turn,text
121,"o edel maeghd , hoe zijtg zoo gelijck Van aert die klaere zelf , naer wien gy heten Klaerisse ? waer vinde ick onderscheit in dees gelijckenisse ? toen het sarazijnsch heir vermeesteren al de stadt Daer Sinte Klaere zijn , hoe droeghze zich ? zy trden Grootmoedigh in de poort van 't klooster , daerze wonen : en zagh de vyant wech , zoo ras hy zich vertonen . haer moeden , haer sterck geloof , en yverigh gebedden verstreckte haer een zwaert , en harnas , en helmet . Gy mooght dan , nu gy hebben die zelleve gedacht , met my , voor dit altaer , de vyand verwachten . maer treckme ( dat mijn doot zy verr ' van schande en smaet ) eerst aen dit stram lijf mijn staetighste gewaet , Gelijck een bisschop voeght , eer krijgsliên ons verrassen . Zet my de mijter op : hy zullen niet qualijck passen op mjjn zalven kruin . brengen hier de gouden ringk , en steeck aen deze hant , die beven , de vingerlingk , Daer ick de bruit van't Sticht , de roomsch kerck , meê troude . Geef my de herdersstaf , tot steunssel van mijn oud , daar ick Godts kudde meê gehoeden hebben , en geweit : 'k hebben noit de teken van het bisdom afgeleit met willen , maer door bedwangk : al leven ick als bannen ; al ruimen ick Henrick plaets , en Willem , en twee Jannen . en het waer een klein verlies , al hebben men my verkorten in naem en eer , zijn slechts geen christensch bloet storten , en zoo veel zaets vertreên van mensch - en paerdevoet . Most niet onschuldigh volck de schult de heeren boeten ? nu kind , zetten u hier , en dat een yder non met my de lofzang zingen van oud Simeon ."
122,"Vergun , ô Godt op zijn bede , naer uw belofte , uw ' knecht verlof ; op dat hy reize in rust en vrede om hoogh naer het hemelsch vredehof : Naerdien ick met mijn eigen ooog Den algemeenen heilant zagh , die als een zon schijnen uit de hoogen ; Daer yder zich in verblijden magh : een schoone zon , die met haer straelen het blind heidendom verlichten , en Jakobs huis en isrel paelen verheerlijcken , en noch veel vast stichten ."
123,"dat gden u al spaere , zijn het hier noch tijt van zingen ! de vyant zackt vast neêr , om 't klooster te bespringen . oom Gozewijn , koom hier : gy zijn stockout en traegh ; Gedoogh dat ick u op mijn beide schouder draegh . klaeris nicht , gy zult my volgen met dees reien , Waer Godt , of het goet geluck ons al willen geleien . nu vader , volgh mijn ' raet . de vyant woeden en raest . wie 't leven berg willen , die bergh het in de haest ."
124,"gemack , mijn trouw neef , gy mooght dees moeite derven ."
125,"Wy zijn alleens gezint , en wel getroosten te sterven ."
126,"hoe nu ? hebben gden my dan , door water en door vier , door spiets en zwaert geredden , en menigh blanck rappier , dat ick de bisschop noch voor 't outer zullen zien slaghten , en in het laeuw bloet de nonnekens verkrachten ? dat werde nimmer waer . ô Goddelijck geslacht ! nicht Machtels geest verschijnen mijn lief deze nacht : een stem belasten my haer kinen en oom te bergen . haer schimme waert om u : en moeten ick het u noch vergen ? en maecktge zelf uw ziel noch schuldigh aen die moort ? de krijgslien zijn niet verr ' van deze kloosterpoort , die leght met eenen slagh te aerde neêrgeworpen . dees godtgewijd vloer zullen het kuisch bloet haest slorpen . het krijgsvolck naderen vast , ick horen het aen 't gedruis . ick bidden om zijnent willen , die levendigh aen 't kruis om ons genagelen hangen , voor Sions wreede muuren : Ick biden u om zijn hant-en voet-en hartquetsuuren , en om de doorne kroon , die het hoven verpletten en brack , en om de scherp spiets , die in zijn zijde stack ; Vergunme deze troost , in zoo veel zwaerichede , dat ick uw leven berg : ô vader ; dat ick heden Onschuldigh blijven magh aen uwer al bloet . dit eenig zijn mijn wensch : en kunnen ick uw gemoedt door smeecken noch gebeên noch bittre traenen buigen ; Zoo nemen ick Godt en al zijn heilg tot getuigen , dat geenerley gevaer , noch zelf de fel doot , My hinderen uw lijf te bergen in de noot ."
127,"Gy hebben godvruchtigh , neef , u neffens ons gequeten . Wy zullen het noch voor Godt noch engel vergeeten . Den grooten Godt alleen zy eer in het hemelrijck . Wy bidden u , staan op : gy doen ons ongelijck , dat gy te aerde knielen voor sterffelijcke mensch . hoe zullen ick schooner doot na ' et lang leven wenschen , dan hier voor martelaer , op deze heilge steê , te offeren mijn bloet , in het vierighs van mijn beê , op het allerhooghste feest van Godts geboortenisse ! waer of de doot vertreckt ? ick heb een rein gewis , en haeckte lang te gaen naer al ziel bedden ; al sedert dat ick uit mijn ' zetel wert opzetten , toen Uitrecht , dat de vorst , gelijck zijn ' vader , eren , door staetzucht opgeruit , my wars den neck toekeren : van die tijt zijn ick al dit lastigh leven moe ."
128,"daer zijn de vyant zelf . ick vliegh naer boven toe , en zullen , zoo lang ick magh , de kloosterpoort beschutten , of mijn hulp noch kosten uw leven onderstutten ."
129,"heer broeder , wel wat zijn dit ? hoe keertg dus alleen ! o Godt , waer blijven mijn heer ? zijn hy blijven ?"
130,neen .
131,"wat tijding brengtg dan ? zegh op , zijn hy blijven ?"
132,ick laten hem voor het stadthuis gezont en noch in 't leven .
133,"helaes ! waer magh hy zijn , mijn troost , mijn hoop , mijn hooft . en keertge zonder hem ? dit hadge niet beloven ."
134,"versla u niet , maer toef . gy zullen hem haest aenschouw ."
135,"dat toeven valtme bang . och zijn hy slechts behouwen , in het onweêr , dat de staet in zee drijven zonder roer . ick bidden , verhaelme toch al wat u wedervoer ."
136,"Gy eischt een ' zware eisch . wie zullen daer niet voor gruwen ? het zullen ons hartewee en droefheit slechts vernuwen . wie horen dit treurspel aen , die niet zijn traan laet ? al stont hier grobber zelf , en het heiloos bastertzaet , het waer onmogelijck dat hy dit hoor kond , het zijn een nieuw slagh in mijn versche wond . oock steeckenwe al bey noch midden in de druck : en wachten op de slagh van 't uiterst ongeluck , te zy het Godt verzie , en zetten de wraecke paelen : doch nu gy het zoo begeren , horen toe , ick zullen het verhaelen . Wy quaam niet zoo haest omtrent de middeldam , daer wat vergaering zijn van burgren , men vernemen , hoe het ingetrocken heir de nieuw zyde alreede Vermeestert hebben , het volck onnutten weêrstant den ; Dies Gysbreght laten gebiên , men zullen in vaerdigheit de brug , daer de stadt zich recht in 't midden scheit , verbranden , en voor al de Middeldam bezetten ; om zijn vyants overkomst , waer het mooghlijck , te beletten , en dat men d'oude zy moght vrijen voor gevaer , schoon of het krijghsvolck van de nieuw meester waer . Hy zellef zijn de voorst , om elleck moeden te geven , en gaan daer op met ons naer merckt en raethuis streven , en broght met al zijn maght de burger op de been , die rucken hier en daer van allesin by een . men spannen keten , voor het haestig verrasschen . men stoppen de toegang dicht met zacken , kist , kas , en alles wat men reedst kunnen vinden by de hant . toen vliegen wy met hem te zaemen naer de brant , om , waer het mogelijck , daer orde op te stellen : maer laes ! het zijn te spa . wat mont kunnen u vertellen Den zuuren arrebeit van deze naeren nacht , en met hoe groot een ' moort die over wort gebraght ? men zagh de doôn gestroit langs burreghwal , en straeten : geen ' kruiswegh , die niet dicht bezetten zijn van soldaeten . men ziet'er allesins verbaestheit , en men horen zich mengen onder een bloetstorting , brant en moort . de groote aeloude stadt , vermaert in ooreloog , Zoo scheeprijck , en voor wie zich zee en stroomen boog , de vreemd en nagebuur , en rijcken tot ontzagh , gaet plotselijck te grond , en zinckt met eenen slagh . Wy worden niet te min door wanhoop aengedreven , dat menig graefsgezinde en Kermer kosten zijn leven : en het amsterlantsche bloet en sneuvelen niet alleen . de lijcken groeien aen , en leggen onder een , het aenzicht naer de straet gekeren , of op hun rug . de kennis van de wegh , van stijgen , straeten , brug , en stadts gelegentheit , by schijnen van de maen , Quam dapper ons te baet , en hiel de drom staen Der vyanden , die dick het zeeten op een loopen . dan ging'er eens een deur , en dan een venster open , Wy groeien in getal en moeden , en ruckten voort , of het mooghlijck hebben zijn de haerelemmer poort , die overweldight zijn , met dooden te verkroppen ; en weêr met kracht al wat in steê zijn uit te kloppen ; maer quaam voelen te spa . de nau ontslippen wachten verhaelde ons hoe alree de voortoght met de kracht Der ruitren binnen zijn : wie zullen daer tegen mogen ? en schoon men hier en daer een brugh hebben opgetogen , men recht weinigh uit . de brant nemen ymmer toe . d'ontsteltheit zijn te groot . men weten niet waer , of hoe . mijn broêr , proost Willem , quam , laden onder d'arm met overschot van 't kruis de heilants : helpen beschermen ons hooftkerck , rijck bouten te eere van Katrijn , en Jesus moeder zelf . ô burger , berght Kristijn , Heer Gysbreghts zuster toch ; en naulyx kosten hy spreecken . ick hebze in het vrouwekoor al beven versteecken , en raeckte naulyx uit . de lantreus is'er veur . men horen zijn stem . hy lopen met boomen op de deur . om Godts willen , gaet de kerck op het hooge feest ontzetten . wy schieten derwaert aen , om 't onheil te beletten , als tyger , die , by nacht van honger uitgejaeght , gebeeten zijn op roof . wy vliegen onvertsaeght door vier en zwaerden heen , om 't al voor Godt te waegen : maer vinden voor ons komst de kerckdeur opgeslaegen , en hoor eenen galm , die uitberst over straet , en over al de stadt , en Godt voor het voorhoven slaet , in zijn hoogen troon , als eer de kerck de Joden . d ' Altaeren en het koor zijn ophopen met dooden . wat bleef'er ongeschenen ! wat kreegh'er niet een ' krack ! het gevlughte volleck zitten op trans , gewelf , en dack , en biet noch tegenweer , en quetst ons zelfs met steenen en hout uit misverstant . men horen de vrouw weenen , en kind , die vol schrick krioelen hier en daer , de binnetranssen langs . de kaerssen op het altaer zijn zommigen gebluscht , en zommigen die blaecken . de kerreckschenner woên , en passen wat te raecken , en vechten om de buit , en plondren het al , oock zelf het Marianum , dat te pronck hangen aen 't gewelf , Wort afgeruckt . men zetten in het glibbrigh bloet zijn stap . men torst'er kelcken uit , kassuiffelen , en kappen , die stijf staen van gesteente , en parlen en root gout , om het heerelijck , als het plagh , wanneer men hooghtijt houden , en koor en outerkleên . de Kersnacht lagh in stucken ."
137,hoe gaan het u met Kristijn ? hoe most dit Gysbreght drucken !
138,"en my : bedenck dat eens . hoe staet my het schouspel voor ! men sleipteze by het hair uit ons lievrouwe koor , om d'arm dun en teêr met koord stijf binden . hoe diep gaan dit in 't hart , die naer haer huwlijck staan ! doch Heemskerck veel , die dol dit lang niet verdroegh , toen zy naer's hemels troon haer blaecken ooog sloegh . Wy sluiten ons wel dicht , en volghen hem altzamen , en rucktenze uit de maght de knevler : daer op quaeem de Gelderschen , de Zeeu , de Vries en Kennemaer Van allesins te hoop , vol spijts , op 't groot misbaer , en om d'ontruckte maeght : men zagh'er zijn graeven zoonen , men zagh'er d'egmonts zelfs en Diedrick meê zich toonen om het moedighste in die strijt , met Grobber , helsch van aert . de winden buldren zoo , eer het bijster weêr bedaert Des winter , tegen een , en weeten van geen strijcken , en zetten in gevaer de dammen en de dijcken , door het perssen van de vloet . de vyant wert te sterck , en groeien , en deê met kracht ons deizen uit de kerck , en wijcken naer den Dam , om versch te zijn stijven . neef Heemskerck hebben by 't koor alreê de geest geven , die ridderlijcke hellen en eere van zijn ' stam . polaenen viel'er by , die hem te hulpe quam , en niemant weeck in moeden noch billijckheit van oordeel , en Kuick , hem zeer gelijck . hier hebben de deught geen voordeel . het heilighdom van 't kruis de proost deê weinigh nuts . geen stool beschut hem , noch geen vierkant muts , noch geen godtvruchtigheit kunnen Jesus priester helpen , toen wy , ô Willem broêr , uw bloet niet moghten stelpen . daer gy te sneuvlen quaemen , recht over het hoogh altaer ."
139,wat horen ick hier al leeds ! hoe voelen ick my zoo naer ! Verhael my evenwel al d'overig elende . 't begin vernoeghtme niet : ik verlangen met schrick naer het ende . hoe kosten mijn droef man zoo scheiden van zijn bloet ?
140,"in zoo veel ramp hiel hy al de zelven moeden , en yveren om de Dam te houden onbezweecken , waer langs de vyant zoeken geweldigh in te breecken : Gelijck een waterstroom gewellen baert op een sluis , en elx gehoor verdoven met ysselijck gedruisch . de deur kant zich geweldigh tegen 't wringen Des springvloets ; voor een wijl , tot dat zy open springen , en geven 't water ruimen , de springvloet vryen toom , die winnen dan vellen , en ruckt de wortel met de boom , en huis en hof om veer , en zetten de laege land in eene baere zee , met groen en nieuw strand . dus gaan het , na dat men wel een heel uur lang de Dam Verdadight hebben , zoo dra de burgery de vlam te daecke van de kerck te hemel uitgeslaegen , en het heerelijck gebouw zagh branden licht laegen , en horen het moortgeschrey de volx , dat out en jong van boven , om het vier t'ontgaen , te berste springen , of in de spietsen vallen te aerde . dit gezichte Benam hun al de moeden . de helsch Grobber stichte met een wijden toorts de branden in het heiligh dack . hoe leden het Godt , dat hem de moort niet eer en stack ! toen zijn het elck voor zich , een yder bergh zijn leven . mijn broeder roepen , ick zullen my flux op 't slot begeven , en zijn gemaelin en kind gade slaen . Hy zelf weeck op het stadthuis , en blijven de lessen staen . ick wert op wegh verlet , en koom de burgh bewaeren , en hoop de goed Godt zullen mijn ' heer broeder spaeren ."
141,"een hoopelooze hoop . och Gysbreght , lief heer , Ick rekenen u al doot , en zien u nimmer weêr ."
142,"waer wert oprecht trou dan tusschen man en vrou te werellen oien vinden ? twee ziel , gloênde aen een gesmeet of vast geschakelen en verbinden in lief en leden . de bant , die 't hart zijn de moeder aen het kinen , Gebaert met wee en smarte , Aen haere borst met melck gevoeden , Zoo lang gedraegen onder 't hart , Verbint het bloet . noch stercker zijn de bant Van het paer , door hant aen hant Verknocht , om niet te scheiden , na datze jaeren lang gepaert een kuisch en vreedzaem leven leiden , Gelijck van aert . daer zoo de liefde vallen , smolt liefde ziel met ziel , en hart met hart te gader . die liefde zijn stercker dan de doot . geen liefde komen Godts liefde nader , noch zijn zoo groot . geen water bluscht dit vuur , het edelst , dat natuur te weerellen hebben ontsteecken , dit zijn het krachtighs ciment , dat hart zijn , als muuren breecken tot puin in het enden . door deze liefde treuren de tortelduif , gescheuren van heer bemind tortel . Zy jammeren op de dor ranck Van eenen boom , verdrooght van wortel , haer leven langk . zoo treuren nu aemstel vrou , en smilt , als sneeuw , van rou tot water en tot traenen . Zy rekenen gysbrecht nu al doot , die om zijn stadt en onderdaenen zicht geven te bloot . o Godt , vetlicht haer kruis , dat zy de hellen op 't huis met blijdschap magh ontfang , die tusschen hoop en vreeze drijven , en zucht , en uitzien met verlangen waer Aemstel blijven ."
143,"My dunckt ick horen gerucht : daer roepen een aen de poort . gden lof , het zijn mijn heer : ick hebben zijn stem gehoren . het vyfde bedryf ."
144,"MYn lief , hoe hebtge dus uw ooog uitgekreten ?"
145,"nu gy behouden zijn . zijn al mijn leet vergeten , mijn trouw bruidegom , mijn hooft , mijn troost , mijn schat : nu gy behouden zijn , wat geven ick om de stadt , om al het wereltsch goeden ! hoe zijtge hier komen ?"
146,"na dat de vyant nu de Dam hebben innemen , nemen ick en 't overschot naer het raethuis toe de wijck , en hiel hem staen met kracht , als water voor de dijck ; daer het lantvolck opkleppen zich zoecken by nacht te redden , en brengen vast zode aen , en steen , paelen , bed , en bulster , en al wat de zeedijck stutten kunnen , Waer die zijn doorgeweeckt ; en zweet met al man . dat spijten de grooten reus , die laten zich vreeslijck hooren , en stack met hals en hooft , gelijck een steil toren en spits , boven het volck en al hoofd uit , en schijnen een olyfant , die omsnoft met zijn ' snuit . zijn spietse zijn een mast in zijn grof vinger . ick zagh hem man op man gelijk konijn slingeren wel driemael om zijn hooft , vatten by het eene been , en kneus dan het hooft op stoep of op steen . Hy kunnen met zijn pols een ' burghwal over springen , Hy proeven op grendelen de deught de staele kling , Houwt fel met eenen slagh door yzer en door stael , en proeven zyn beckeneel op poort van metael . Hy schijnen een polyfeem , het krijghsvolckscheen zijn kudde . de toren van het stadthuis beweeghde zich en schudden , zo dick hy op een ' post , of op de gevel stiet . Hy vrezen Herkles knods noch Samsons vuist niet . de kermer volgen hem , en noorderlantsche knecht . men voeren de stormbock aen : men gaet de ladder recht , en klimmen , met d'eene hant te gevel uitgestrecken , in d'ander met de schillen , die hals en hooft bedeckt voor eene hagelbuy van steenen hout en pylen . ons jeught , daer tegen aen , die wentelt heele stylen en eicke balleek , en uitgelezen hout , en wat'er zijn van out tot pracht en prael gebouwt , van boven in de hoop ; en ofos luttel hoopen , zoo dienen het om hun huit te dierste te verkoopen , en burgermeesteren en raeid voor te staen , tot quyting van de eedt haer overheit gedaen . men ziet'er zelf het bloet de overheit verhitten , en stijven de gemeent : behalve die hier zitten blootshoven , en half gekleet , en zonder weer te biên , Van zwacken ouderdom ; en durreven wel zien Zoo eetelijck een doot kloeckhartigh onder ooog ; en vechten met hun hart , nu hand niet en mogen . een deel de burgery beneên met hellebaerd en sabelen en spiets de poort en muur bewaert . ick steegh de toren op , die boven het dack komen rijzen , in 't midden van het stadthuis ; van waer men u kunnen wijzen de tent om de stadt , en hoe al 't leger lagh , en van wie trans men flaeu de dom van Uitrecht zagh , By klaer en helder weêr . ik zagh hier uit hoeze strijden , en met de storrembock de poort gewellen aen doen , en ramden reis op reis , verdadight door een dack van schild , dicht gevoeght . de deur geven krack op krack . Wy stellen flux in het werck de dissel , en de bijl , en houwen in het ront in stucken al stijl , en stoten spits en al het gevaert van boven af ; het welck een ' slagh en roock de merreckt over geven ; en maeckte een vreeslijck loch in zoo veel ysre kop ; dat ander terstont , gevoeght in orde , stoppen . Terwijle stack de kerck de naeste huis aen . Van daer beginnen de vlam in het leien dack te slaen van het raethuis , en de roock en smoock verblinde ons oogen . de poort bezweeck , het volck quam razen ingevlogen . ik zijn al mijn vriend quijten , en stont verbaest en stom ."
147,en zaegtge toen noch niet naer vrouw en kind om ?
148,"in die verbaestheit schijnen een nevel uit de hoogen en goddelijcke glans te blincken voor mijn ooog , en uit die heldre wolck quam eene stemme voort . ick hebben het licht zien , en zelf de stem gehoren : O Gysbreght , laetg nu klaeris uw nicht verlegen ? Magh u oom Gozewijn , die grijs , niet bewegen ? en steltg huis en vrouw en kind in gevaer ? toen schrickte ick , en steegh af , en packen my van daer , door een ' verholen gang , die uitkomen in een ' kelder . ik aenbden het heiligh licht , dat voor my gaan zoo helder . ick raecken op straet , en quam in 't klooster vranck en vry . maer niemant gaf gehoor , noch luisteren nae my , die tegen 't ongeval noch reuckeloos willen wrijten , en boven op het dack my in het uiterst quijten : want eer ick boven quam , lagh poort en post om veer : Dies gleê ick by een touw in het kloosterschuitje neêr , dat juist noch achter lagh , en ik voer de Aemstel over . daer klimmen ick op een ' boom , nu dor en zonder lover , en luisteren hoe het met Godts klooster voort vergaan . My docht dat ick het misbaer met bey mijn oor vangen , en zagh , toen ick een poos verbaest hebben zitten proncken , een ' dicken roock en smoock , en na de roock de voncken , Ick horen paerdevolck , dat langs de Doelebrugh Quam trapplen naer ons toe . mijn voet worden vlugh . men hebben , ô groot verzuim , dees brugh niet afgesmeeten . ick vloogh'er heen , en zoeken te stillen die vast kreeten , en geven hun moedt , en willen de ruiter houden staen : Zy zullen achter my de brugh in stucken slaen , of steecken haer in brant : maer niemant durven het waegen . oock zagh ick d'oude zy nu branden licht laegen ; een voorbô van het geen zijn naderhant gebeuren , en dat de Middeldam alreê most zijn gescheurt ; Dies geven ick het op , en voort de gansch stadt te goed , en waerschuwen yeder een , en gafme langs de veste Naer 't slot toe , met een sleip van mensch arm en rijck , een ' troosteloozen hoop , die herwaert nemen de wijck ."
149,"Most ick de bisschop noch zien sterven en d'abdisse ? och vader Gozewijn ! och , rein maeght Klaerisse !"
150,hoe zijn het mogelijck dat gy het hebben konnen zien ?
151,"het zijn mooglijck , guntg my dat ick u daer op die . toen Heemskerck Borsselen gevelen hebben voor uw ooog , Lagh het lijck te zijde 't koor , in eenen hoeck getogen , na dat ick in de drang de vyants my verstack , mits gy te rugge weeckt , en vielen dat pas te zwack . zoo dra men , om de branden , de groote kerck most ruimen , ontwapende ick de doode , en zetten helm en pluim Van Borsselen op het hoven , en toogh zijn rusting aen , en binden het zwaert op zy , om in die schijn te gaen ons vyand bespiên , en letten hoe men het maecken . Ick volghde Haemste na , toen hy in 't klooster raecken , en vloogh de kerckdeur in , daer Gozewijn noch zitten , in 't midden van de rey , die even vierigh bden , en door een vast geloof op Godt zoo moedigh steunen , dat niemant zich het woên de vyand bekreunen . Hy schijnen een zon gelijck , en zy de klaere maen ; al d'andren starren , die met vreught te reye gaen , en juichen om dees twee , daer zy haer ' glans uit scheppen . men zaghze naulyx yet dan kuisch lip reppen . maer Haemste vaert hem toe met opgestroopten arm , beklad en root , en van Kristijnes bloet noch warm , en vat hem by de baert met d'eene , met de deeg Gereet in d'andre hant , bebloet en bloot . toen stijgen de non op , en geen , hoe lieflijck van gemoeden , die geen leeuwin geleeck , wanneerze brullen en woeden , dewijl de jaeger 't nest willen plondren en beroven . Zoo quam oprecht trouw en eedle gramschap boven . Zy worstelen een wijl . Klaeris zetten voet by voet , omarremmen Gozewijn , omringen van haeren stoet . wie zullen het godtvruchtigh hooft een hair bezeeren kunnen , Omheint meten eenen muur van godtverloofde non , Gestrengelt arm in arm ? ô christelijcke knoop ! ick zien de deughden zelfs , geloven , en liefde , en Hoop , met haere zuster , die tegen Ondeught strijden , en naer de zege staen door kruis en medelijden . de vyant stont versust , en deizen om deze zaeck : maer het aenzien van Klaeris beweeghde 't hart tot wraeck , en braght hem in de zin de moort van zijn vader , en dat zy d'afkomst zijn van Velzen , de verrader . Hy blaecken , en kreegh een koorts , en door de koorts dorst Naer heur en aemstel bloet , en stiet eerst door de borst met zijn ' bebloeden dolck dan d'eene non , dan d'andere . Zy vallen overhoop , en liggen by elckandere in het ront , gelijck een krans van roozen , wit en root . toen staan Klaerisse daer by Gozewijn , ontbloten Van menschelijcke hulp . gy zoudze bey zien proncken , als bloem op haer ' steel , in eenen bemen , verdroncken Van eenen rooden plas . d'een zuchte noch , en d'een Vertrock het hooft , die d'arm , en deze noch haer been . een ander hebben de geest zoo daetelijck geven . de bisschop . schoon hy stont op d'oever van zijn leven , betomen zich niet eens van gramschap en van rouw . uw vader ley de hant wel eerloos aen een vrouw , maer zuipen noit vrouwenbloet , of zijn daer om gelastert . dus blijcken het datg zijn een overwinnen basteren , Naer lichaem en naer geest ; nu gy uw aert betoon aen non , die altijt in het woeden zijn verschoont . en d'ander antwoort hem : gy zullen deze eedle reien , als bastertbisschop , dan gaen volgen , en gelei . hardtneckige , legh nu de valschen mijter neêr . Zoo sprack het bastertzaet . en rucken hem om veer met stoel met al in het bloet : de mijter viel'er mede . klaerisse viel'er by , toen zy haer goed dede , en hiel hem even sterck om zijn hals vatten . en schijnen gevormen albast , met purper overspat . Hy duwen het bloedigh zwaert in zijn grijs stram zijde , tot aen het vergullen gevest . zoo zagh men eer , te tijd van 't blind heidendom , voor het aengesteken vier , met zijn priester mes gekelen een wit offerstier , met gulde hoornen , en wie rugh de kranssen decken ."
152,hoe droegh klaerisse zich ?
