turn,text
153,"Zy holp de deeg trecken uit zijn oom gewond zijde , en zetten hem terstont Den mijter op het hooft , en kust de bleecken mont . Hy openen pijnelijck zijn halfgelokene ooog , en zietze noch eens aen , en schijnen met haer bewegen , die hem zijn ooog luicken . hy geven de lesten zucht . Zy vangen de veegen geest , en die benaude lucht , en zwijmt een poos van druck . maer Haemstede , eerze weder Bekomt , die worrept haer op het doode lichaem neder , en boet'er schendigh meê zijn ' godtvergeten lusten . z ' ontwaeckt in het ende , en wort van het schellemstuck bewust , en roepen : mijn bruidegom , zien neder hoe ick lije , en hoe men my schoffeert . ô zuivre maeght Marije ! o Klaere , aenschouwtg dit ? vrouw Machtelt , zien uw kinen . de booswicht slaet heur klaght en woord in de winnen , Gelijck een vogel grijpen 't gepiep de simple duif , als hy'er uit de vlught een vast krijght in zijn kluif . gaan heen , zeght hy , klaegh uw moeder uw smart . Hy trappeltze op de buick , en op het benaeude hart , dat haer het bloeden te neus en mond uit quam vliegen , en zy de de dootsnick geven , en sluiten die hemelsch ooog , en uitgaan ofze slapen , in zijn Bisschops open arm ."
154,"horen gden dan lang niet het jammerlijck gekerm van zijn wijden bruit ? of lusten het hem de boosheit te stijven in haer quaet , door zijn strafteloosheit ?"
155,"zijn toen zijn moeden gekoelen van al schendery , en d'oude wrock gepaeit ."
156,"het bleef'er noch niet by . niet ver van het altaer , vereren met rijcke gaaf , Stont een albaste tombe : in deze lagh begraven het kostelijck gebeente en d'overheilige asch van een ' , die om 't geloven aen Godt gemartelen zijn ; daer most de snood schelm zich zelven noch aen wreecken . het zijn wonder , als Godt zwijght , dat dooden niet en spreecken , Hy schonze , en sloegh'er aen zijn klaeuw , vuil van bloet , en brackos brullen op met grooten overmoeden . terstont quam hem een geur en yet wat lieflijcks tegen : maer die verwaten mensch , [ wat zullen zijn hart bewegen ! ] vaert grimmigh voort , en stroit de beender hier en daer , en smijten de tombe in twee ; en breeckt 't wijden altaer , gebiet terstont de brant in het kloosterdack te steecken . het vier nemen d'overhant , waer voor de plondraers weecken . ick quam omtrent de Beurs , te water uitgebouwen , nu half gebrant , en zagh al het zilverwerck en gout , Geplondert heylighdom , tapijt , en schildrij , scharlaken , en fluweel , langs heen de gaelerij geworpen overhoop , daer grobber hiel de wacht . de vlamme spelen in het gout , en schitteren by nacht . men zagh'er by een schaer van weduwe en weezen , Bekreeten en bedruckt , en die noch erg vreezen . Zoo raecken ick onbekent door het krijghsvolck heen by 't slot , tot berging van mijn lijf . ik vertrouwen my u en Godt . de winnen steeckt op ; men horen hem in de vlam bruis . een zee van gloet verdrinckt al d'overig huis . de burgh lijt last . het waer best dat ghy een ' uytval doen , en dan de brugh afbraeckt ."
157,mijn broeder staet gereet
158,"WAt zien we te gemoet ? de burghzaet komen vlieden . mijn man lopen weêr te rugh , en zoeckt vast by de dooden zijn ' broeder , die hy missen , en al te trouw beminnen , en niet verlaeten zullen , het en zy dat hy hem vint , en levendigh of doot magh torssen op de rugge , in 't uiterst gevaer . daer sloopenze de brugge . helaes ! wat gaet my aen ? waer vinde ick mijn heer ;"
159,"och , broeder , laetme los ."
160,hoe zijn het ?
161,ik kunnen niet veel .
162,"hoe zijn het , Arent broêr ?"
163,nu doen ons eenigh teken .
164,"ick zijn de adem quijten . ick kunnen niet lang spreecken . mijn hart bezwijcken door het bloên . ick hebben mijn plicht voldaen , mijn vaderlijcke stadt te ende voorgestaen , Nae dat ick hebben zoo lang in ballingschap zwerven . heer broeder , ik nemen verlof , en als ick zijn sterven Zoo varen , indienge moeten verlaeten deze plaets , mijn lijck met u , op dat de wraecklust de soldaets het niet onteere , en gunnen het een wijden stede . gedenck mijn ziel voor Godt , ô priester , in uw bede . ick schey , ick zwijm , ick sterven . mijn tijt zijn hier zijn . och vriend , bidden voor my , ô Godt , ontfang mijn ' geest ."
165,"Hy zijn bereght , en hebben gena by Godt verwerven ."
166,"Hy zijn met krijghsmans eere in het harrenas sterven , en volght zijn ' broeder Ot in het hemelsch vaderlant , en triomferen by Godt ."
167,"gy missen uw recht hant . nu zullen hy zich voortaen te uitval niet beledigen , noch het vrelandsch slot noch dit met zulck een ' moeten verdedigen , noch 't amsterdamsch recht beschutten met zijn zwaert , en draef door het heir op een luid brieschen paert , om prijs en eer in 't stof door zweet en bloet te winnen ."
168,men trecke het lichaem uit : men draeg ' de doode binnen .
169,"MYn heer , uw ongeluck zijn ons van hart leet . Wy staen voor deze graft tot storreem gereet . het Waer tijden en veel dan tijt , dat gy u kort beraede , en gaven het huis voort op , met hope van genade , en schutte d'ongena . ick eisch het in zijn graeven naem , door veltheer Egmonds last ."
170,"Gy eischt dat ik het my schaem . ick schey'er zoo niet af , als met mijn eigen leven , en eer ick sterref zullen noch menigh met my sneven ."
171,zijn het eere dat een hellen zich zelf verreuckeloos ' ?
172,men houden de plaets op hoop .
173,hier zijn geen hoop altoos . met houden zijn hier niet met al uit te rechten .
174,dat magh men dan bezien . wy zullen ' er om vechten .
175,"het zijn vechtens tijt , eer noch de vyant uw stadt , de poort , en de vest geheel vermeesteren hebben . toen al klocken brant en moort en onraet klepten , en burger en soldaet om het zeer hun hand reppen : nu die verweldight zijn , het raethuis afgebrant , en wat in 't harnas blonck , gesneuvelt en vermant , zijn het al vergeefs het slot en overschot verdadight . bera u kort , gy wort misschien noch begenadight ."
176,het zijn mijn gewoonte niet te bidden om gena .
177,"het zijn wijsheit dat men zich uit noot te buiten gaan , en zijn gewoonte staecke , en stellen het gevaer voor ooog . Zy kiezen 't best van twee , die goed niet en mogen ."
178,"ik verwachten een uitkomst dan , en geven het op aen Godt ."
179,"wat uitkomst wachtge toch ? gy zullen terstonnen dit slot van al kant zien beladdren , en bespringen ."
180,"men zalme van het y zoo lichtelijck niet dwingen . ick hebben noch over al veel vriend op mijn hant . mijn toeverlaet , naest Godt , zijn y en waterkant ."
181,"geloofme , ik zoeck u niet met woord te vertsaegen , Ghy zullen het van die kant zoo heerlijck op zien dag , met schuit zonder tal , eer u de zon beschijn ' . wat riem voeren of zeil hebben amirael Persijn Beslaegen in zijn ' dienst by Vries en Waterlanderen . al het omgelegen volck ruckt haestigh by elckanderen , en treckt vast op de brant van kerck en toren aen . hoe zijn het mogelijck die maght te wederstaen , met zoo een hant vol volx , dat door de nederlaegen Der versch vernielen stadt vol schrix zijn , en verslaegen ? Gy vielen , het zijn waer , van 't slot op uw vyant uit : wat holp het ? men drijven u in . gy waert zoo kort stuiten , en keren op uw burgh met roô bebloed kop , Van vreeze dat men u de toegang toe moght stoppen ."
182,"ik ontfing geen leedt , alleen mijn boezem zagh bemorst Van bloet , vermits een kay , geslingeren langs mijn borst , het vel hebben afgeschuurt , en effen het vleesch wrijven . geen dootschrick drijven ons veel dan wy ons zelven drijven ."
183,daer niet gewinnen wort zijn het ydel dat men strijt .
184,"een krijgsman winnen genoegh , al winnen hy niet dan tijt ."
185,"het zijn raedzaem by verdragh , en niet uit noot geven ."
186,"mijn moeder leren my , dat ick geen ' raet zullen leven met vyand , waer van men het arghste moeten vermoên . mijn heer , ick hebben uw ' raet voor dees tijt niet van doen ."
187,"mijn meester hart trecken naer al braaf held , die voor hun eere en erf zich vroom te weere stellen . d'onmatigheit van wraeck , gepleeght na Velzens doën , hebben Egmont noit bestemmen , noch yemants schullen vergroten . ick kennen hem , als my zelf : hy mint u in het byzonder ."
188,"Hy mint my , als het blijckt , en keren het boven onder . Hy mint my averechts . zijn liefde staet ons dier . wie hebben de stadt vernielen , verwoesten met zwaert en vier . en al de nacht gewoeden , als willen en uitgelaeten ? wie stoppen de Aemstel toe met dooden ? wie de straeten ? waer zien men niet de vlam van die gesticht brant ? wat grafsteê , wat altaer , wat kerck hebben zijn roover hant verschoont ? wat heilighdom , kapel , klooster , non zijn van die klaeuw niet geschantvlecken , en geschon ? op dat ick niet en repp ' , hoe gruwzaem zijn soldaet na'et schennen martlen durven de godtgewijden staet ; Daer al de volgen eeuw met laster van zullen spreecken , en dat godts streng gerecht te zijn tijt willen wreecken ."
189,"dit , leider ! zijn een nacht vol ramp , vol ongeval : maer dat men overste willen schuiven op de hals al wat'er zijn misdaen by krijgsliên zonder orde , en die door geen gezagh in toom houden worden By die gelegentheit , dat lijden de reden niet , noch leren d'ervarentheit , en zijn wel veel geschiet ; byzonder daer het hart van wraecklust zijn bezeten . wie keren een ' dollen leeuw , na het breecken van zijn keten ? Hy volght zijn ' wreed aert , en vlieght met eenen lopen , en grabbelen blindelingh de reedsten uit de hoop . wanneer het verbolgen zwaert geraekt uit's krijgsmans scheeën , het keren ' er langsaem in , en acht gebden noch bede , zien vorst noch veltheer aen . het zwaert , geterght van wraeck en gramschap , vint in het bloet de vyants zoeten smaeck . de duisternis de nacht maeckt al ding oock gruwelijck : dan schijnen het , wat men daeghs zich schamen zullen , min schuwelijck , in dees bloetdronckenschap , en blind en dartle lust , die tot een vonxken toe al 't licht van reden bluscht , uit tam mensch scheppen onredelijcke dier , men moeten , men willen of niet , dan het heir de teugel vieren . mijn meester toen hy eerst voor uw vest quam , willen wel bemaghtigen de muur van Amsterdam , Maer in de gront de stadt zoo schendigh te verdelgen , zijn noit zijn wit , en het vallen hem bitter te verzwelgen : hoewel het krijghsrecht hem verschoont ; hy verreght niet het uiterst van zijn recht , en straffen noch met verdriet : zijn tot verzachting en verschooning veel genegen , dan al te stijf te staen op 't punt van zijn deeg . verschoon uw leven toch , en gunnen dees eer aen my ."
190,"ick zijn met eenen doën voor al mijn leven vry . vertreck , en wachten u my veel tijding te brengen . ik Getroost my al wat gden u toelaet te gehengen . WY geven vooren kort en duidelijck bescheet . Gy horen , hoe het oorloghsvolck tot storm staet gereet : waerom het noodigh waer , eer zy dit huis besluit van achter met een vloot van schip en van schuit , My van onnut gezin , en die geen nootweer biên , t'ontslaen , en met de bloem de man te voorzien , die machtigh zijn het gewellen de vyants af te keeren , het welck ons komen aen boren met storrembrugh en leêren . mijn lief , geven u scheep : al zijn het scheiden pijn , het zijn noodigh . Peter zullen uw trouw leitsman zijn , en dit gevlughte volck en u en uw kind vervoeren naer een wijck , daer niemannen u kunnen hinderen . getroost u daer een wijl te wachten , tot dat gden ons weder t'zamenbrenge , en gunne een goed lot ."
191,"helaes , wat gaan ick aen ? wat komen my weder over ? waer zentge my , mijn lief , persijn de grooten roover uw ' vyant in de mont , die op ons vlammen en loeren uit Zwaenenburgh , daer hy de graeven vlagge voeren ? 't verdriet hem zulck een slot en vasten burgh te derven , die onrechten gift . uw zaet , uw wettig erf te blusschen in haer bloet , zijn al zijn wensch en wit , op dat hy onverlet volharde in 't nieuw bezit ."
192,"mevrouw , zijn wel getroosten : ick zullen u zelf geleiden ."
193,'k nemen oorlof met een kus .
194,"ick zullen van 't huis niet scheiden noch scheep gaen zonder u , mijn heer , mijn waerde man ."
195,ick volgen u eer gy het weten .
196,daer weetg luttel van .
197,"de stroom zijn wijten genoegh , al stoptmen deze haven , een schuit ontslippen het licht ."
198,"men zullen u hier begraven , Bestulpen onder 't puin . ick zien dit huis in brant ."
199,d'onsterffelijcke gden hebben alles in zijn hant .
200,"och , of de goed gden zich mijnes willen ontfermen ."
201,"mevrouw , betrouwen op hem : hy kunnen ons wel beschermen , en voeren zijn eigendom door water vier en vlam ."
202,gelijck de brant getuight van 't gloeiend Amsterdam .
203,het zijn zijn gehengenis . wie durven zich daer in mengen ?
204,"wanneer ons leet geschiet , dan zullen hy het oock gehengen ."
205,"mijn lief gemaelin , gy stellen u het zwaerste voor ."
206,"uw droefheit houden geen maet , het benevelen brein geen spoor . nu vollegh raet , mevrouw , en laet u toch gezeggen ."
207,"och , moederlief , wat raet ? zy komen 't huis beleggen . bewaer mijn reinigheit , mijn ' maeghdelijcken staet ."
208,"och , dochter , moeder troost zijn krancke toeverlaet . de klockhen decken vergeefs het sidderen kiecken voor een ' doortrapten vos met schaduw van haer wiecken : Hy grijptze beide , en stroit de pluim in de winnen , en koelen zijn ' lusten , en ruckt de moeder van het kinen ."
209,zullen gy dan oirzaeck zijn dat beide uw kind sneven ?
210,ick zullen om eenen man wel bey mijn kind geven .
211,"Beweeght uw kroost u niet , dit jongske kleen en teêr ?"
212,"niet luttel , maer mijn man beweeghtme noch al veel ."
213,wat schreitg moederlief ? zijn gy bedroeven om vader ?
214,"om vader schrey ick , kinen , om u en ons te gader ."
215,uw moeder keren zich niet aen u noch uw smert .
216,"met smerte baerde ick het kinen , en droegh het onder 't hart . mijn man zijn zelf het hart . 'k hebben zonder hem geen leven . 'k zullen u om lief noch leden bezwijcken noch begeven . ik beloven u houden en trouw te blijven tot de doot ."
217,"het zijn oock getrouwigheit , wanneer men scheien uit noot ."
218,"men scheit om goed willen , om weder te verzaemen ."
219,"indien ick van hem schey , wy komen nimmer t'zaeem ."
220,"gy scheide menighmael , en zaeght hem weêr gezont ."
221,"ick scheide noit , daer het zoo bedroeven scheppen stont ."
222,de weerhaen van de kans kunnen lichtelijck verkeeren .
223,"'t verkeerd noit zoo snel , of het zijn om my te deeren ."
224,het zijn best de kind dan in zekerheit gebroght .
225,"het zijn best , en hielme niet de bant de echt verknocht ."
226,een vrouw gedijen tot last : zy weten niet uit te rechten .
227,"bestelme slechts een zwaert , ick zijn bereit te vechten , te sterven aen de zy van mijn vromen man ."
228,Gy hebben een vrouwenhart .
229,"nemen eens de proef daer van . heldin staan eer als onbeweeghde post . de faem van vrouw roemen , die stadt en volck verlosten . uw moeder Baerte tonen hoe veel een vrouw vermagh , wanneer zy Ysselstein verdaedight jaer en dagh ."
230,"ick waerschouw u , mijn heer , eerwe overrompelen worden . de triomfeerder stellen zijn vaendel in slaghorden , en d'eer de één storm verguntme aen de Vries , die het volck in orde stellen : ons dienen geen tijdtverlies . men voeren de stormbrugh aen : men steeckt'er de trompet . het zijn over tijden de muur en toren te bezetten ."
231,"al lang genoegh gemart : dewijl de noot u pressen , gehoorzaem uw heer , en kussen hem eens voor 't lessen ."
232,"zeer gaerne , braaf hellen , vergunme slechts een bede , en ruck , het zijn mijn wil , dit lemmer uit de schede , en stoten het door dees borst , en doop het in dit bloet . het zijn goed dat gy het zelf dan Vries of Kermer doen , als ick u hebben de geest zien geven door uw wond , mijn zoon zonder hooft , mijn dochter schenden , en horen al 't huis vervullen met brant met moortgeschreeuw . Zoo sterven ick noch uw vrouw , geen kinderlooze weeuw ! Zoo magh mijn kinen , of gy noch bey deze ooog luicken , Naerdien ick 's leven licht niet lang magh gebruicken ."
233,"o gruwel , Badeloch , zijn ick van zulck een ' aert , dat ick een vrouw , en noch mijn eigen , met mijn zwaert , Zoo eerelijck voor haer , voor kind , en maag , en deze goed gemenen mijn leven lang dragegen , vermoorden zullen , gelijck een gruwelijck tyran ? Zoo zijn ick lang niet uw bedgenoot , uw man : zoo hebben gy onbekent dus lang my verslijten , en ick mijn Christendom verzaeckt , mijn ' plicht vergeten . hoe laetg zulck een woort uw ' kuischen mont ontgaen ? of wiltge , dat ick u altzamen zullen verraên , en my aen uw doden en schennis schuldigh maecken ? het zijn tijt om weer te biên : de vyand genaecken . het godloos bastertzaet , beweeght door geen misbaer , dat ons nicht Klaeris van Velzen , voor het altaer en het kruisbelen , in 't gezicht haers bruidegom verkrachten , en trappelen op het hart , en om de dootsnick lachen , zullen daetlijck deze burgh veroveren verwoet . ick zullen mijn vrouw , mijn zaet zien in elckanders bloet versticken . grobber zullen het in eenen beker schincken , en dat , zoo laeuw als het zijn , de vader op doen drincken , op dat d'ontruste geest doorwaer ' zijn ingewant , en pijnig ' voor zijn doot het los en vlot verstant . waer zijtg dienaers ? waer mijn lijfwacht ? waer mijn knaap ? brengen herwaert mijn geweer , op man , wapen , wapen . het zijn de jong dagh , en met dit huis gedaen . noch zullen het wraeckeloos zoo niet te grond gaen : daer moeten een groot getal met ons te hemel vaeren . komen volghme , daerwe flus in 't harnas bezigh zijn , in 't midden van de moort . ik gevoel een nieuw kracht ."
234,"waer wiltg heene ? uw zelf verdrincken in de gracht ? de slotbrugh brant vast af . of hebtge voor te sterven , Zoo nemen ons t'zamen meê : hier zijn uw wettig erf , de huwbaere adelgund , d'onnoosle Veenerick . mijn hairen staen te bergh : hoe kloppen mijn hart van schrick ! och vader , het zijn mijn schult : och , zijn zoo niet verbolgen . bedaer wat : ick gaan scheep : ick zullen de deken volgen , te water en te land : hy voerme waer het hem lusten , of naer den wilde Yr , of aen de noortsche kust . nu vrezen ick geen gevaer , noch geene uitheemsch strand . ick nemen verlof . ick gaan : ick kus voor 't lessen uw hand , gehoorzaem u , gelijck een christe vrouwe passen . ick schrey en klaegh vergeefs . och man , houden hem vast . mijn heer , ontfermen u toch om uw bedruckte vrouwe : Zy luisteren naer uw ' raet : zy zwijmen : zy sterven van rouw ."
235,"och , vader , moeder sterven . wat gaet my leider aen ! het en zy gy wat bedaert , het zijn met haer gedaen ."
236,"om Godts willen , geven gehoor : gy zien hoe zy u min ."
237,"wat razery zijn dit ! wat onverzetbre zin ! men recht met jammeren noch jancken hier niet uit : de traenen doen het hem niet . de wreetheit wort stuiten met dapperheit en moeden . waer laet gy u vervoeren ! het kermen zijn onnut : men moeten de hand roeren . scheep , scheep . nu zijn getroosten , mijn lief , de tijt zijn kort ."
238,"voor 't scheiden , laetme toe dat ick mijn bede storten . heer Peter , bidden voor ons , dat gden deze arm schaere door zijn engel stuure , en mijn heer bewaere ."
239,"Gy die de vromen schillen en wisse toevlught zijn , en van de hemel af de jammerlijcken strijt Der mensch gade slaet , en zien de stad daelen , en wentelen , en zetten de heerschappij paelen ; erbarm u over dit bedruckt belegeren slot : beschermen het rechtvaerdigh hooft , en bergh het overschot Der uitgeroide stadt , genootzaeckt door de baeren , in lang ballingschap , op Godts gena , te vaeren , Gy hebben het huisgezin van Noah wel behoeden , dat op de baeren drijven en hooog watervloet ; toen 't water immer wies , tot daer de ster bloncken , toen het hemelhoogh geberghte en al spits zoncken , en al de weerelt lagh in eene baere zee Gedompelt over het hoven , en kennen strant noch ree . Gy trooste door de duif die overbleve ziel . d'olijftack zey haer aen hoe al watren vallen . vertroost ons desgelijx in droef ballingschap . Gy weten daer van de maet , en kennen de lesten stap . uw geest die blaeze in 't zeil : uw heilig engel stiere het roer , en zetten ons op , daer elck u vrolijck viere ."
240,"O Gysbreght , zetten getroosten uw schouder onder 't kruis u opgeleien van Godt . het zijn al vergeefs dit huis Verdaedight ; hebben wy het in ons behoeden nemen , het waer met Amsterdam zoo ver noit komen : dus wederstreef niet veel uw trouw gemaelin . verlaet uw wettigh erf , en quel u nergens in . al leght de stadt verwoesten , en willen daer van niet yzen : Zy zullen met grooter glans uit asch en stof verrijzen ! want d'oppersen beleit zijn zaecken wonderbaer . de hollantsche gemeent zullen , eer dry hondert jaer Verloopen , zich met maght van bontgenooten stercken , en schoppen het roomsch altaer met kracht uit al kercken , Verklaeren het graefflijck hoven vervallen zijn recht , en heerschen staetsgewijs ; het welck een bits gevecht , en endeloozen krijgh en onweêr zullen verwecken , dat zich gansch Christenrijck te bloedigh aen willen trecken . in 't midden van de twist , en het woeden nimmer moe , verheffen u stadt haer kroon tot aen de hemel toe , en gaet door vier en ys een andre weerellen vinden , en donderen met geschut op al vier de wind . uw afkomst midlerwijl zullen geensin onder gaen , Maer eeuwigh adelijck en eerelijck bestaen , op sloot en in steên ; en loffelijck regeeren , en Aemstels oud naem zullen geenen lof ontbeeren ; als uw naemhafte stadt haer ' Schouburgh open doen , en voeren op het hoogh tooneel uw daeid te gemoet Den burgermeesteren , en drymael twalef raeden , zitten op uw ' schillen , van kruissen overlaeden . dus geven u haestigh scheep : het zijn tijt , want zonder Godt en ons hulp , het zijn onkomen met dit slot . ick zullen u met een ' missen en dicken nevel decken , en voorgaen met mijn ' glans , de volcke een leidstar strecken , in 't midden van de stroom . schep moeden , en wanhoop niet , maer volgh gehoorzaem na het geen u gden gebiet . zijn wil zijn , dat gy treckt naer 't vet lant van Pruissen , Daer uit het Poolsch gebergen de wijsselstroom komen ruisschen , die d'oever rijck van vrucht genoeghelijck bespoelen . Verhou u daer , en wachten tot dat de wraeck verkoelen . Gy zullen in dit gewest een stadt , nieuw hollant , bouwen , en in gezond lucht , en weelig landouw , vergeten al uw leet , en overbrogten druck ; waer door uw naezaet klimmen de bergh op van het geluck . vallen u het verwoesten de godtsdienstigheit te lastigh , Volhardt by het out geloof en Godts altaer stantvastigh , op 't spoor de oud , u moedigh voorgetreên . Zoo draven men recht naer Godt , door al star heen ."
241,"zijn gy dat Rafaël ? zijn gy dat zelf , die beyde Tobias en zijn bruit zoo veiligh t'huis geleide ? of liever d'afgezant de hemels , die zoo klaer voor Moses trock , gelijck een vierig pilaer ? of die de vromen Loth noch berghde , eer het vier van boven de stad stack in brant ? of die de gloênden oven Verkoelde , en brogt'er gaef dry jongeling uit ? wy volgen op uw licht : wy zien het zijn Godts besluit ."
242,"nu buigh ick my voor Godt , mijn lief , mijn uitverkiezen . nu weigeren ick geenfin naer uw raet te hooren , en legh hier 't harnas af . hier baet geen tegenweer : nu gden dit huis verlaet , en gelt'er zwaert noch speer . al het volck gaan voor , dan het lijck , en niemant hoeven te vreezen ; Ick zelf met mijn gezin zullen d'allerleste wezen . heer Peter , ik bidden u , tasten dit heïligh kruisbelen aen , dat voor mijn oudren lang hebben op het altaer gestaen , en my zijn aenge-erft . ick storte in tijt van vrede en oorlogh menighmael hier voor mijn vierge bede , zoo wel de nacht als daeghs . horen man , horen na my . wanneer men uit de stroom en Pampus raecken voorby , zoo doen te slincke hant in zee zich op wat weilant , dat Marcken heten van out , een laegh en visschers eilant , het welck een klooster draeght genaemt Mariengaerd , een rijcke en oud abdy : wy zullen derrewaert ons spoên , voor winnen voor stroom , met riem en met zeilen , en daer de vloot verzien , en voorraet ommedeil , en leven wijd raet . gaet scheep in die gestalt , Gelijck ick hebben belasten . helaes ! hoe bitter vallen het scheiden van zijn lant , daer alles lopen verliezen !"
243,de liefde tot zijn lant zijn yeder aengeboren .
244,"verdelghde stadt , wy gaen , en komen nimmer weêr ,"
245,"vaer wel , mijn aemsterlant : verwachten een ' andren heer . uit ."
