turn,text
494,"mijn dorst die zijn vergaen . drincken Grave eens voor my , gy zullen mijn gunst verwerven . eerst haar majesteyt , door die ick niet zullen derven Vorstin u hoonen , neen ! de een dronck komen u . Ick zegh gy drincken zullen , verrader , wert gy schuw voor het vergift , daer gy my menen meê te zende na Lethe , voort drinck uyt . ach ! waer zullen ick my wennen ."
495,"tot deze dranck , of het stael . Vorstin my 't lijf verschonen ."
496,"Hy zijn het lijf niet waerd , die zich barmhartigh tonen te uwaerts , snoo verraêr . Ick wieren helaes ! dwingen"
497,van die de strot zijn door de koort stijf toe dringen .
498,"drinck uyt dees wijn , wie geur het bang hart verquickt . waer voor het benauwen hart van my anghstvalligls schrickt . daer voelen ick het vergift verspreyen door mijn leeden . Ay my ! helaes ! ick sterven ."
499,"Ia vaer al voort beneden daer de verradery haer zeetel hebben , hier tonen Den Onger hoe het quaet zijn eyg meester lonen ."
500,"doorluchte koningin , dat uw slacf uw hand Magh groeten met een kus , nu hy aen u de land Van Koning Bela komen opoffren , zijn koning broêr ."
501,"melen aen de koning zelfs wat hem al wedervoer , Zoo kunnen hy na verdienst u rijckelijck vergelden ."
502,wat zijn ' er gaens in 't Hof ?
503,"dat zullen de Rijxtroon melden . waer op de Dwingelant ontzielen zitten , deze bant Den moorder hebben vermoren , Antonio van kant zich zelfs door het vergift helpen . danck nu gode die 't Rijck verlosten , toen de koort de rijxpest doode ."
504,"ha droef gezicht , helaes !"
505,nu leven mijn ziel voldaen .
506,lang leven de koningin .
507,ick blijven haer onderdaen .
508,"waer zijn de Prins Mathijs , de naeste aen ong'ren kroone ."
509,die zullen hier daet lijck zijn .
510,"de weerelt komen u toonen Gy Princen , dat die geen na hooge Staetzucht trachten te klimmen , nederstort , al eer hy het hebben denken . Laet Napels , en Ferraer haer nu op het hooghs verwond'ren ;"
511,als dit de Onger zullen vol smaet in d'oor dond'ren wat Napels Koningin hebben door haer hant bestieren .
512,"nu zullen , prins Lodewijck , uw hayren zijn geciert met Napels kroon die my de Onger docht t ' ontwringen ."
513,Gy op de troon ? hy doën ? ha wat verandering ?
514,"zoo stijgen rechtvaerdigheyden te troon , na ramp , en druck ."
515,"Wy wensch Napels heyl , haer koningin geluck ."
516,"schoon dat hy zijn mijn neef , hy waer dees straf waerdigh , liefwaerde Isabel , de hemel tonen rechtvaerdigh dat zy de trotsheydt straffen , die treur niet , het gaet na wensch ."
517,"het dier dat mensch plaegen , dat noemen de mensch een mensch ."
518,"mijn prins , 'k hebben voor de doot behoeden uw ziels bemind ."
519,Zy komen te laet .
520,hoe dat !
521,"de Kroon my willen verbinden Aen haar majesteyt , de vreucht geen uytstel lijten ."
522,"Zoo houden ick haer voor my . hier erf ick op een tijt een kroon , en heffen . Princes , ik groeten u als Koninginne ,"
523,Ick u als Ong'rens Vorst .
524,"hoe wonder gaet het min . nu moeten gy Margareet , of Laura zijn voor my . ten schelen my niet wie het zijn , wy zijn zoo goet als zy . hoe willen het nu in 't hof gaen wacker op een min ."
525,"Zy zijn belust op vleesch , die op u stellen haer zin ."
526,"mijn leven , goet , en bloet zijn voor Vorst Lodewijck ."
527,nu het maghtigh Napels haer vereent met het Ongers Rijck .
528,"daer zitten hy in zijn bloet gestickt , die het al willen smooren ."
529,"wie door de koort ontzielen , gaet door de koort verlooren ."
530,dus zien men afkorten Andreas leven draet .
531,geen quader Prins als die zijn eyg welvaert haet .
