turn,text
1,"een bedryf . een vertooning voor het spel . die van tessaliën en Colchos opgetoogen , zien vrouw Medeaas konst en wonderlyk vermoogen , Zy staan gereed om hen de kracht van haar kruid te toonen , en de winst van Colchos ryke buit ; waar door zy Vaderland en vader durven verraaad , om zich in weelde met haar minnaar te verzaaden ; maar zy zullen haaar straf meê kryg op haar beurt , die steets , met naberouw , ellendig worden betreurden . Twede vertooning voor het spel . daar zien de Aanschouweren verbazen het een wonder ; 't Volk van tessaliën speelen met hun gunst hier onder , dat geven Held Jazon moed , die zaaidt de draaketandt , uit zynen koop'ren helm , in het omgeploegde landen , 't welk , met een sap gemengen , dit zaadt beginnen te weeken , en nieuw lichchaaam verwekken aan kunnen kweeken . de Grieken zien ontsteld , dit nieuw geboor zaden de speeren vel naar Emoniërs Soldaat . wat helpen het of men zijn in wapentucht bedreeven , wanneer dat broeder elkander staan na het leeven . hoe groote leger zelf een Vorst gebied mogen , hoe zeer zyn rykdom groeid , zyn aanzien en gezag ; noch rykdom , aanzien , noch gezag zullen staan blyf , wanneer de Twist zyn volk door Tweedracht komen te styven ; door Tweedracht , die de staat de eenigheid splitsen ; Terwyl de wraak het bloed zelfs tegen bloed ophitst . drie vertooning voor het spel . gints hangen dat schit'ren goud op groen en zilv're blad'ren , het geen , zonder doodsgevaar , van niemant zijn te nad'ren . de Stier en draak , die nacht en dag op schildwacht staan , zien , al die daar verschynt met dreigen ooog aan ; Zy snuiven vuur en vlam , en damp , en missen , en waasem te keel uit , dat al de aard stinken van die helschen aasem . Den dap'ren Jazon , die weêrgadeloozen Held , Krygt , door Medeaas kunst , het vlies in zyn geweld . daar zien men Sciron , die , omsollen onversleeten , Zyn naam draagen in de klip , waar in hy worden gesmeeten . Den Ouden Ezon krygen weêr nieuw kracht en moed , en voelden zich zelfverjongen en vol van jeugdig bloed . hier na worden een dans van Krygshelden vertonen . een tooneel ."
2,"o Overhaat'lyk hof ! ô Hof dat my doen gruuwen ! zullen Jazon , myn Gemaal , tot afschrik van het huuwen , Kreüzaas koets bekleên ? ô snoode trouwloosheid ! geen boozer Schelm dan die zich van zyn Ega scheiden . noch zijn hy boozer zo hy and're durven beminnen . zijn dit het loon dat ik hem het gulde Vlies doen winnen ? o onverdraagb're spyt ! o ongeneesb're wond ! trouwbreeker , vrouwepest , en Vloek van het kuis verbinden , om welk een reden hebben gy de echt band schenden ? de Trouw worden slechts door dood of overspel ontbinden . o Huuwelykstieran ! weten gy wel wie gy hoond ? het zijn Medea , die , als zy haar kracht betoond , de wind , Starren , zon . hoofdstof , Bliksemstraalen , en donderklooten , door haar kunst , kunnen bepaalen , ik Hits de element , en wat schrikk'lyk zijn , aan een . hoe ! zullen ik lyden dat gy weêr zullen huuwen ? neen ! ik hebben myn broeder , om met u door trouw te paaren , van een gereeten , en de stuk in de baaren , half leevendig strooien , die zien wat dat gy doen : Dorst ik de zwart Zee rood verwennen met zyn bloed , om u te trouwen in 't gedrang de priestereijen ? ik zullen , nu ik u haat , om Broeders geest te peijen , u doen gevoelen wat ik broeder hebben doen : wat min aan hem bestaan , zullen haat aan u bestaan . ik hebben te wreed een moord , ô Schelm ! om u bedreeven : alleen de min kunnen my dit gruuw'lyk stuk vergeeven . ik zelf vergeven myn hart die snoode boosheid niet ; of ik zullen , door myn hand , die hem de borst doorstiet , de moordvlak van myn hand in Jazons broed uitspoelen : ik moeten , ik willen , en zullen myn hevigheid verkoelen : want zy begeren dat ik u naad'ren zullen met straf : maar wachten niet dat ik u zullen dompelen in 't graf . het graf zijn het rustbed van al die ellendig leeven . wie lang willen wreeken moeten geen kort moordsteek geeven . dies zullen myn bitt're haat , die staâg om weêrwraak brullen , de wreede zuster , die met slang zyn hullen , met pynboomtoortzen in haar scherp geklaauwde hand , tot hulpe roepen , om u nacht en dag te aanranden . wie groot van magt zijn lyd zich met geen kleene wraak , of zijn dit noch te zwak , tot redding van myn zaak ? zo zullen ik al het gedrogt gelyk te voorschyn vloeken , en schenden het op u aan , om u , in al hoek van de aard te volgen , in een gruuwely schyn . de Wanhoop , boos van aard , die rust zoeken door fenyn ; het knaagen gemoed , een geessel de gedacht : en de yselyke schrikken , ontzach'lyk door haar kracht , Zyn u te straf stellen , tot zoen van ons hoon . wie langzaam worden doden sterven meêr dan duizend doôn . Kreüza zullen myn haten hier tusschen niet verpoozen ; Zy sierden haar bruiloftsbed met purperverfde roozen ; maar ik zullen haar , ik zweren het , de doorn in het hart op 't diep doen steeken : want ik worden tot wraak getart . een fel wederwraak zijn kwaalyk te bepaalen . uw ledikant verwachten geen klank van Nachtegaalen , doormengen met maatgezang van Maagden , schel van keel ; want uw nachtkoets ; neen ! uw geil lustpriëel , zullen gruuwzaam grimmelen van Gieren , Kraaijen , uil , en zwart Ravens , die , met schreeuwen , gillen , huilen en krassen , uw gehoor , als gy in wellust zyt , verschrikken zullen ; zo zullen ik myn hart vol spyt , een vuur dat vinnig blaken , ontlasten van myn koortzen . weg , blyde Hymen , weg , met uw gewyde toortzen , de wreedst van 't boos gedrogt zullen , voor dit bruiloftsbed , haar ongewyde toorts , van leevend mensch vet , Bespat van traaan , klam van brein en bloed , ontsteek . ik willen my aan dit paar op het allerfelste wreeken . de wraakzucht van een vrouw zijn scherp dan een schicht . hier komtze die myn hart , door dienst , aan zich verpliggen . Twede tooneel ."
3,"MYn Voesterkind , hoe dus ? hoe zyt gy dus aan het woeden ?"
4,Myn boezem worden bestreên van bitt're tegenspoed :
5,de rampspoed zwichten voor een die alles temmen kunnen .
6,een edel hart gedogen geen byzit van haar man .
7,wie hoon en spyt verwind ontmoeten een heilzaam leeven .
8,een hooggeboore ziel verdragen geen tegenstreeven .
9,de huuwlyksnektar vinden men veel doormengen met gal .
10,een koninklyk gemoed verkroppen geen ongeval .
11,kunnen deez ' Oranje noch citroen u niet verluchten ?
12,"het lot zijn my te wrang , die haten ik wrang vrucht ."
13,slauw gezicht eens op dit roosryk Lustprieel .
14,"ik wraken de roozen , want ik vindze scherp van steel ."
15,"verkoel u by deez ' bron , zo zullen gy aassem haalen ."
16,"kunnen ik het Water , dat uit deze bron komen straalen , en al de beek , die in Kreons oord zyn , door kracht van toov'ren , veranderen in fenyn , ik zullen ze in zwelg , en , al zullen ik zelver gruuwen , prins Jazon en zyn bruid verwoed in 't aanzicht spuuwen , en barste ik aan 't vergif , zo sterven ik zegenryk ."
17,men wreken zich allerbest door 't zien van zijn vyands lyk . maar uw toverkunst beginnen allengs te flaauwen .
18,"hebben ik de stier , met gespleete koop're klaauw , met yz're hoorene , en gloeijend ingewand , in het Juk gespannen , en het veld langs Facis strand , al druipende van zweet , in wederwil , doen ploegen , ik zullen hem licht , om myn wraaklust te vernoegen , voor my doen zwichten , dan die dier groot van kracht . al waar hy roem op draagd hebben hy door my volbragt . hebben hy het land bezaaien met scherp draake tand , daar krygs-liên , heten op moord , met sabel in hun hand en heel in het harrenas uitwiessen tot zyn leed , ik hebben die menschenoegst , die broeder , bar en wreed Elkaâr doen dood , eer zy hem verwoed bespringen . wie sluiten de draak zyn bek , die drie gesplitste tong en zo veel reegel van tand en kies hebben , noch dik van groen gal en heten vergif bekladden , daar 't bloedig mensch vleesch by spier in bleefhangen , zijn het Jazons sabel ? neen : ik komen dat schrikdier prang . ondankbere , gy zullen met uw Bywyf bloên . de wraak moeten blind zyn of zy zijn te laf in het woên ."
19,hoe ! staan gy naar de dood van die uw hart doorgrieven ?
20,"de hartstocht van de wraak zijn sterk dan de liefde , Zy moeten door geweld , of kunst verwonnen zyn . de wraak gebruiken of strop of sabel of fenyn . drie tooneel . HOu stant , wie dat gy zyt , of het kosten u daad'lyk het leeven . ik willen , in tegen willen van u , te Hof instreeven ."
21,zo gy my naad'ren durven ontmoeten ik u met kracht .
22,ik willen dat aanstonds worden verpletten dit boos geslacht .
23,"uw wond'ren zyn te kleen , of hebben gy meêr vermoogen ?"
24,"ik zullen meêr wonder maar tot uw schaâ vertooog , Gy zullen voortaan , gelyk een rots , hier blyven staan . een ander spiegel zich hoe u dit zijn vergaan . Deez ' Roê hebben kracht om u tot hard steen te scheppen ."
25,"helaas ! och , wat zijn dit ? ik weten my niet te reppen , Myn lid worden hard . ik zullen my aan u wree ...."
26,"uw wreeken zijn vergeefs , ik maken uw kracht gedwee . blyf hier op schildwacht staan , om and'ren uit te houwen ."
27,"herschep myn Wachtbroêr , of ik zweren het zullen u rouwen ."
28,het zullen my rouwen zo ik u niet voort betoom .
29,ik schrikken niet meêr voor u dan voor een eikeboom .
30,veranderen in een Eik voor uw vermeetelheid .
31,ik voelen myn lichchaam van een hard schorsen bekleeden ; Myn arm zyn alreê in telg vol van blaâ ....
32,"al wie Medea hoond vervallen in ongenaâ . wykt , trouw dienaar , wykt , of ik zullen u bezweeren ."
33,"mevrouw , ik horen gerucht , ik bidden u , laten ons keeren ."
34,hoe ! keeren zonder wraak ? het zullen zo niet overgaan ....
35,"Myn dochter , schuil , ei , schuil !"
36,"wie vrees hebben mogen wel gaan . o schrand're veinzery ! pylaar de wyste Staaten , o hart in gal deursult ! en mond vol honingraaten ! bestier myn bitt're tong en geven ze een zoet klank ; maken dat ik jazon smeken met een sireene zank . hoe ! zijn het geen lafheid ? neen ! de wysheid komen my raaden . o eed'le dapperheid ! hullen met lauwerblaaad , die u in het harrenas op het Dagtooneel laten zien , vergeven myn veinzery , de nood komen my gebiên ."
37,vier tooneel .
38,"toen ik het Gulde Vlies te Kolchos hebben gekreegen , zijn heel Thessalien hovaardig op de zegen : maar nu ik u verkryg zijn de eer van 't Vlies verdoven . een schoon en wyze Maagd worden nooit te hoog geloven . uw gaaaf blinken meêr dan duizend gulde Vliezen ."
39,"uw Faam , die in geen eeuw haar luisteren zullen verliezen , alwaarde Bruidegom , zijn prikkel van myn min : maar uw Kreüza vrezen ."
40,"wat vrezen , myn koningin ?"
41,' Myn boezem barsten van spyt : de wraak deurkruipen myn aad'ren .
42,wie komen hier op ons aan ?
43,ik zien Medea naad'ren .
44,ik zullen myn blank kling rood verwennen in haar bloed .
45,"Kreüza , schoone bruid , prins Jazon , vol van moed , de groote Juno moeten u in haar kerk ontfangen . nooit moeten de droevig Uil uw oor met lykgezang , op 't echt ledekant , verstoor uw rust . uw Bruiloftstoorts zy nooit in traaan uitgebluscht . ik wensch u , in uw trouw , een stroom van al zeeg'nen ."
46,"ik , dat u deze dag mogen al ramp bejeeg'nen ."
47,ik wensch het vorst'lyk Huis een onverwrikb're stand .
48,"ik wensch om u tot asch , eerlang , te zien verbranden ."
49,ik wensch dat uw zaad nooit sterven door overval van moord .
50,"vertrek , ik zeggen vertrek , uit Kreons Stad en oord ."
51,"ik zullen niet roemen dat gy 't Vlies door my genieten . ik klagen ook niet dat gy my , om Kreüz ' , verstoot . ik hebben geen deel aan u , myn voorrecht zijn vervallen . ik zoeken slechts voor een nacht huisvesting in uw wal ."
52,"uw mond zijn vol van zoet , uw boezem vol fenyn ."
53,"ach ! Jazon , laten dit Hof een nacht myn huisvesten zyn . wie vreemdeling bergen kunnen vyanden beweegen . een Ryk , dat gastvry zijn , verkrygen de ryk zegen . een zegenryk gewest behoud een vast stand . ontzeggen gy Ballingen te bergen in uw Land ?"
54,een broedermoorster lyd men in geen Hofgebouwen .
55,ik hebben myn Broêr alleen verdelgen om u te trouwen . oprecht liefde toond zich onverzagen van aard . een bruidegom zijn meêr dan duizend Broeders waard .
56,o veinzende gedrogt ! die elk in list doen zwichten .
57,"o schitterend zon ! wie straalen het al verlichten , die , door uw licht , doed zien wat diep verbergen leiden , u roepen ik tot getuig van myn oprechtigheid : Gy weten dat deze borst geen veinzery kunnen zetten : gedoog ook niet , ô zon ! dat zy my komen besmetten ; ik haten haar dubbelheid , die kwaalyk zijn te ontgaan ."
58,"waarom zijn Pelias , gelyk uw Broêr , verraân ?"
59,Zyn dochter hebben hem in het laauwe bloed doen baaden .
60,"Gy hebben haar , door uw raad , te schandelyk verraden ; want gy beloven ' hem jong te vorm na het bloên . geen snooder kwaad dan kwaad in schyn van deugd te doen . wie raad tot moord geest hebben de een moord bedreeven ; want hy hebben met zyn willen de steek in 't hart gegeeven eer dat de Moorder 't zwaard gesleepen hebben op 't hart . het werktuig zijn veel min dan de oorzaak van de smart . begeven u naar het noord met uw gehaate vinden ."
61,"de Faam hebben duizendmaal met duizend koop're mond , in 't Noord geblaazen 't lof de deugd van Griekenland , Dies laten my hier in 't West , daar gy de kroon in spand , de deugd de Grieken zien die wy in 't Noorden hooren . de waarheid weten men eer door de ooog dan door de oor . het zien hebben groot kracht dan het zeggen van de Faam . zijn uw genadigheid zo groot , gelyk uw naam , dan zullen gy my , geloven ik vast , niet laaten dwaalen , het zijn prinsselyk zyn magt in 't straf te bepaalen ."
62,noch Prinsselyker dat men het Ryk voor kwaân behoeden .
63,een prins die oordeel hebben betoond zich zacht van moed .
64,wie veilig heerschen willen moeten wys en wakke weezen .
65,een wapenlooze vrouw behoeven men niet te vreezen .
66,"Medea , terg my niet ."
67,Vergun my toch een beê .
68,"wat zijn 't verzoek ? zeggen op , eer ik na het autaar treê ."
69,"dat gy myn zoon , eer ik vertrek , aan my doen geeven . de zucht tot eigen Zaad kunnen niemand tegenstreeven . zelf in geen ongediert , dat redelykheid ontbreken . de Kind'ren worden van de moeder best kweken . de vaderlyke zorg bestaan in hoofsch zaaak wie volk beheerschen moeten kunnen voor geen kind'ren waaken . het Hof vereischt een man die buiten huiszorg gaan . dies bidden ik u , ô prins ! om myn verleeën staan , ach ! om uw Stamhuis , dat nooit bystand plag te weig'ren en om uw daaad , die steil door de star steig'ren , dat gy myn beê verhoren , eer ik dit ryk verlaten ."
70,"verwachten van my geen zoon : want gy zoud hen , tot smaad , doen zitten op uw koets , om hun van vlug draaak ; Terwyl zy vuur en vlam te keel en snuit uitbraaken , in 't Noord te brengen , waar dat Taurus zich vertonen : want dit haten gebergen , van ongediert bewonen , zijn 't school van Toveraars en jong toveres , hier zullen zy , door kracht van uw toverlessen , met Wolven , Tygeren , met Leeuwen , scherp van tand , en Beeren speelen , en hun balg met ingewand , met etter en vuil bloed van rot lyken vullen : elk zullen zich met een pruik van zwart slang hul , en wind , Stroomen , Zeên doen luist'ren naar hun wet . My dunken ik zien hen al bekladden van brein en vet , behangen met een kleed van raauwe mensch huid , en van een darm omgorden , vullen met toverkruiden , om , als het zonlicht zinken in Thetis Zeespelonk , heel naar te toeten op een mergelooze schenken : Zy zullen , in de nacht , by Putten , graaf , galg , schavot , Mikken , Raân , en al wat ons doen walgen , een snoode bevaaren doen , tot schrik van het aardsch geslaggen . de Kind'ren die gy eischt zyn dier van my geächt ."
71,"ik bidden , bewegen de prins , dat ik myn zoon mogen houwen ."
72,"ik hebben myn harteleed , o boost ' van al vrouw ! tot barstens toe verkroppen , om uw redenstryd : ik zijn getergen , getreên , en overvol van spyt : zullen ik u helpen ? neen ! ik zoeken u fel te hoonen ."
73,"uw deugd , geest en glans , elk waardig om te kroonen , Zyn starker dan de kracht van het allergrootst geweld : Gy hebben , prins Jazon zelfs , die zeêgbaar oorlogsheld , die dol stier , draak , en Krygsvolk kunnen verpletten , door uw kracht , stip doen luist'ren naar uw wet : maar dit ontbreken uw kracht , hoe krachtig dat gy zyt , dat gy my noch door smaad , noch bitterheid , noch spyt Kund hoonen , want ik willen uw hoôn gewillig draagen , 'k willen elk mishaag als ik u slegts kunnen behaagen . Span al uw kracht t'zaam , en na my met pyn , Gy zullen veel eer vermoeid van my te straf zyn , dan ik door last van het Juk , dat gy myn nek doed draagen . wie alles lyden kunnen zijn starker dan de plaag . de last zyn my licht zo ik u dienst kunnen doen ."
74,"het zijn tyd , ja over tyd om u naar 't Noord te spoên ."
75,geven Jazons zoon toch meê zo zullen ik noord waar keeren .
76,"hoe ! Jazons Zoonen ? neen , neen ! dochter van Megeere , de wrê Cerbrus , die de nooitverzaadb're Poort Van het duistre Ryk bewaren , hebben u in Plutoos oord Bezwangerd , op dat gy twe Gruuw'len voort zoud brengen ; dit noemd gy Jazons zoon , de spyt willen het niet gehengen . het zijn wonder dat de prins uw lip niet bedwingen ."
77,"' o Veinzery ! gedoog dat ik haar bitt're tong , ' met een verwoed hand , uit haaar keel mogen ryten , ' ik zalze Jazon , rood van bloed , in 't aanzicht smyten ; ' ja spyk'ren voor zyn mond , zo kunnen myn wraak bestaan ."
78,wat spreken gy aan een zy ?
79,"dat ik u hebben misdoen door 't lastig bidden , om myn Zoonen weêr te krygen . de redelykheid gebied , dat ik voor u moeten zwygen ; maar , och ! natuur gebied dat ik myn zoon hier wensch . het voorrecht van Natuur zijn starker dan de mensch . de zucht tot kind zijn van natuur gekoomen . noch zullen ik myn natuur , om dat gy het willen , betoomen : ik willen al wat gy willen : want gy willen niet dan goed ; of dunken my kwaad te zien in het pit van uw gemoed , zo zullen ik myn gezicht noch oordeel niet betrouwen ; en zijn het zeker dat men u voor kwaad moeten houwen , zo zullen ik my nochtans heel voegen naar uw willen ."
80,ik vervloek uw veinzery .
81,"medé , zwyg vaardig stil ."
82,"ik zullen stilzwygen om uw oor niet te krenken ; maar ik zullen dag en nacht niet anders doen dan denken : prins Jazon hebben groot recht dat hy my bitter haat ; Kreüza hebben groot recht dat zy my dreigd met smaad , om dat ik hem en haar verhinder door myn klaag : dit denken , hopen ik , zullen uw oor niet mishaagen . het denken staan elk vry in 't Hof van een tieran ; maar zo het denken u in 't weinig verletten kunnen , zullen ik myn denken in het vergetelnat versmooren , en zyn gelyk ik zijn eer dat ik worden gebooren , ja worden dat ik zijn eer dat ik worden telen . wat eischt gy meêr van my ?"
83,dat gy my niet vervelen .
84,zien wie hier knielden en bidden .
85,uw tong hebben geen vermooog .
86,"zo zullen ik het heele lyfveranderen in ooog , en storten beeken , vloên , ja golleven , en zeên Van traanen , om uw hart van marmer , week te kneên , en 't vuur te blusschen dat de gramschap hebben ontsteeken ."
87,"laten los , ik zeggen , laten los !"
88,Laat my niet lang smeeken .
89,uw kind'ren worden van myn Kamerwacht bewaren .
90,"ik zullen ze haalen : want ik wyk hier voor geen zwaard . noch voor geen hekel van wachtspiets , wreed in het schennen , ik zullen ' er met myn borst , vol moed , op aan gaan rennen , en sterven ik door 't geweer , zo weten ik dat myn bloed Myn ooog luik zullen ."
91,hoe zyt gy dus verwoed ?
92,"waar zyn myn kind , waar zyn zy ? in wat hoek ?"
93,"een zaak hebben ik aan u , ô Jazon ! te verzoeken ."
94,gy mogen gebied . die laten hooren wat gy eischt .
95,"maken dat Medea met haar zoon naar het Noorde reizen , zo zullen de twist zich nooit naa ons drempel wenden . stiefkind'ren weeten man en vrouw aan een te schenden . twedrachtigheid in Trouw zijn wreeder dan de dood . ik zweren u andermaal , zo gy haar t'zaam verstoot , dat gy ons huuwelyk met nektar zullen verëeren ."
96,"ik zweren nu dat gy zweren , om niet te laf te zweeren , By 't duister Styx , ik zweer by het flibb'rig Acheron , By 't bloedig Kocyt , en het gloeijend Flegeton , dat ik uw willen zullen doen ."
97,hoe zullen ik u bedanken ?
98,"verwachten uw kind in het bosch van popelrank . Wy gaan naar het Echtautaar . komen , oorzaak van myn vuur . Vyfde tooneel ."
99,"zal dit de trouw uur zyn ? ô driemaal heiloos uur ! zullen 't een trouw verbinden voor 't laat moeten zwichten ? o Huuwelyks Voogdes ! waar zyn , waar zyn uw schicht of zijn het vuur uw wraaks voor deze twee te koel ? zo zullen ik het gruuwzaam vuur uit Plutoos Jammerpoel Verwoed doen steig'ren , tot schrik van Kreons Muuren . barsten aarde ; barst van een , en braak de fel vuuren , daar gy het booze Volk al zaamen meê bestryd , op deeze twee alleen , nu zijn het de recht tyd : zo hy het ontslippen zo moeten Krëuz ' myn gramschap peijen . hoe ! zullen hy lachchen , en Medea , deerlyk schreijen ? neen ! dat gedoog ik niet , dat waar te groot een pyn ! zullen zy staâg zingen , en ik staâg aan 't zuchten zyn ? neen ! het zullen de slaatschen mensch op het allerheet vertoornen . zullen hy langs Roozen gaan , en ik langs scherp doorn ? neen ! een die magt hebben staat naar wraak door loos beleid . zullen zy vol vreugde zyn , en ik vol droevigheid ? neen ! want de spyt komen my op het wreed tot wraak aan maaan . zál zy wyn plengen , en Medeäas ooog traaan ? neen ! want ik zullen haar noch voor nacht in 't graf doen gaan . zo dit niet vast kunnen staan , zullen ik noch meêr bestaan ; ik zullen Proserpina in Acheron opzoeken , en dringen door 't gedrang de geest , Spooken , vloeken , en al gruuweel , en bidden haar om raad : nooit komen hem hulp te laten die zich op haar verlaten ."
100,wie helpen my uit myn angst ?
101,"ik hebben myn wraak genoomen . van hem . ik willen , dat gy ; als een sater , hier zullen koomen . vertrek uit myn gezicht . 'k willen dat gy voort verzinken , en in een droef zee van jammeren verdrinken . nu zullen zy myn kracht aan Jazon niet ontdekken ; mgen ik myn kunst aan hem en zyn Kreüz ' voltrekken , ik stellen my te werk ; maar 't noodlot tonen hen gunst . het noodlot laten zich niet verzetten van de Konst . waar blyft de vlug boô , die op myn wenk moeten passen ? komen , nemen my vaardig op , ik moeten dit paar verrassen , Breng my in Plutoos Ryk , zo klimmen myn wraak in top . Voort , snel nachtboô , voort , voort nemen my vaardig op ."
102,"Twede bedryf . een vertooning voor het twede Bedryf . PRins Jazon , met zyn volk , door onweêr aan de strand , Van vrouw Hypsyphile , komen daar gelukkig land : Zy heten hem wellekom uit de ongestuime Zee , ontfangen hem vrind'lyk , met zyn held , op haar Ree , en worden , uit liefde , met zyn ongeval bewoogen ; Terwyle zuigen hy vast de vonk uit haaar ooog , zich zelve voelen van zulk een vuur vermanden , geven hy zyn hart haar met het geeven van zyn hand . twede vertooning voor het twede Bedryf . hoe ver de spyt en wrok vervoeren gehoonde vrouw , zullen deez ' vertooning klaar de Volkeren ontvouwen . staatzuchtig amazoon , in byst'ren overmoed . doen man en Slaaf , en kind , hier went'len in hun bloed . vergrammen Hypsiphile , door wraaklust aangedreeven , staat onversaagd , in het spits , naar Jazons dierbaar leeven . Zy , een verlaatene , vol wanhoop , druk en smart , vertoonden hier in een vrouw een dapper mannehart ; en zullen , al zullen zy slaan , gezach , en leeven derven , niet rusten voor zy zijn wroeken door zyn sterven . men leer ' , men kenn ' hier uit , wat onheil al geschieden , wanneer een vrouw haar man dus buitenspoorig zien . een tooneel ."
103,"o vrouw , groot van roem ! ja meêr dan dapp're man , die uw tent voor Korinthen hebben gespannen , om u te wreeken aan prins Jazons trouwloosheên , nu zijn het de recht tyd om hem op 't hart te treên : laten ons niet minder zyn dan strydbaaar amezoonen , die zich in het Oorlogsveld met speer en buigen vertoonen , om haaar vyand te dompelen in 't bloed . een zaamgespanne magtbestaat in fier moed . de fier moedigheid zijn moeder van de zeege . hebben gy de man , door de punt van uw deegen , na dat zy zich , tot spyt van u , vermengen met uitheemsch vrouw , op ons wettig huuw'lyksbed , doen baaad in hun bloed , hier zyn de zelfde reden . ik zullen gewapend naar de wal van Kreon treeden , en eisschen Jazon , eer hy met Kreüza paard : ontzeid hy myn verzoek zo moeten wy , door 't zwaard , de wal in de yl op het allerfel bestryden . een overwoogen wraak kunnen kwaalyk uitstel lyden . komen , priesteres van het Heir , bevorderen ons zaak : Wy knielen voor het autaar van de onverzoenb're wraak . uw zang , met spel doormengen , baard dapper heldin ."
104,"o Nemezis ! het heul van al die wraak beminnen . o onvezoenberste ! die staâg in raadhuis , Hof en Tempels toegang hebben , ontsteken ons offerstof ; waar dat uw vuur verschynt begeren met kracht te toonen . de Dieren die de Lucht , de Zee en aard bewoonen , gevoelen , als haar leed ontmoeten , uw vuurigheên . Gy schend de kind , en ouder tegen een , en mengd de Zee en aard met vrindebloed en traaan : Ontsteek het gewyde hout , laten ons niet lang maanen . wie iet door smeek krygen betalen eer hy verkrygt ."
105,ik danken de wraak nu dat de vlam reeds opwaards stygen .
106,"waar zijn het bloed van 't kind , dat gy , in spyt van het karmen , de moeder , van haar borst , en uit de klem van de arm rukken hebben ? geven het hier ; voort , vorder ons gebod : ik hebben het met dit mes de knobbelig strot Geopend , om het bloed tot weêrwraak in te zwelgen ."
107,O wraak ! ik vangen dit nat : het zap van Bacchus telg behagen my minder dan de smaak van het grieksch bloed .
108,"men drinken het lustig in , om , met een hart vol moed , Terwyl het de tyd gebied , naar 't wreede kwaad te streeven ."
