turn,text
228,"hier zyn wy in 't gezicht van Plutoos yz're muuren , Omheint van Stroomen , die doormengen met zwavelvuuren , de lucht benevelen van het onderaardsche Ryk : de vlam en rook vertonen hier nacht en dag gelyk , twee vyandin die elkander fel bestooken : het grimmeld overal van yzelyke spooken , hullen met Slangen , en met fakkel in de hand . ik zien , waar dat ik komen , een gruuwely stand ; De Poel zijn magtig om afgryslykheên te teelen . ik treê maar onverzagen , op lyken , bekkeneelen , Doodshoofden , schinkel , en geraamte , vuil bekladden . het dor strandbosch zijn van brein en bloed bespatten , doormengen met traaan , merg , en woedend fenynen . laten and're schrikken waar dat gruuwelen verschynen , ik zijn , door dit gezicht , tot in myn ziel , te vreên . wie Tovery beminnen hebben zucht tot gruuwlykheên . komen , gaan wy naar de poort vol grendelen en kram , die Herkles met zyn knots , spyt Cerbrus op komen rammen , en streven ver tot daar hy het heiligdom Van Pluto hebben ontdekken : ik zien een dicht drom Van Spooken naad'ren , om te koomen in deze oord : de staaal poort deur zijn heel rood van mensch moord . hier woond de bitze nyd , die niemand zeege gunnen ; daar het yzer oorelog , dat door de scherp punt Van haaar sabel 't bloed de volk weten te zwelgen . gints wonen de Tweedracht , heten op steeden te verdelgen , wapenen van de Twist : in dit haten gewest Verschynd de koud dood , en overheete Pest , haar veegste dochter , die haar schicht wel laten verroesten , maar als 't haar moordlust willen meêr lyken weten te oesten in eene dag , dan al haar zuster in een jaar . al wat de mensch bestormen verschynt hier by elkaâr . het Lusthof van de Poel hebben lust in heilloosheid . Twede tooneel ."
229,"wie naderden plutoos poort : om in zyn Ryk te treeden ? ik zijn een sterflyk mensch , en zoeken na Charons boot ."
230,"staan af , ik zeggen , staan af , hier wonen de fel dood ."
231,zo zijn ik niet verdwalen ; die laten my binnen streeven .
232,wie brein hebben zullen zich niet in Plutoos Ryk begeeven ; hier binnen worden niet dan heilloosheên verbreiden .
233,wie hulp in de Afgrond zoeken ontzien geen heilloosheid .
234,hier horen men anders niet dan schrik'lyke gerucht .
235,"het jammeren geween , het overnaaar zuchten , en het gruuwzaam tandgeknars zijn my een schel klank , al wat vervaarlyk klinken dienen my voor maatgezang ."
236,wat zyt gy voor een mensch dat gy ons komen bezoeken ?
237,"ik zijn Medea , die de spooken op kunnen vloeken ."
238,nu komen ik uit myn hol : wat hebben gy te gebiên ?
239,"Stamp met uw riem op de aard , zo zullen gy wond'ren zien ."
240,daar stampen ik dat het kraken van binnen en van buiten .
241,zien gy uit uw riem geen versche roozen spruit ?
242,"hebben uw kunst meêr kracht , zo doen my meêr bewys ?"
243,"ik zullen deez ' dor boom , door het raaken van een rys , verscheppen in een mensch . nu zien gy rap leeden ."
244,drie tooneel .
245,"waar zijn ik in wat oord ? ei ! moeder , geven my reden ."
246,"Gy zyt hier voor de poort : verzinken , eer ik u dwingen ."
247,al wat gy hier vertonen achten ik noch voor gering .
248,"nu staan gy met uw voet op Ida , ryk van boomen ."
249,o vreemd wonder ! wie durven hier na koomen ?
250,"hier zien gy Venus , heel omheint van minnegoôn , daar toond zich Pallas , die een helm , in plaats van kroon , op het hulzel hebben ; zy zijn verzellen met zanggodin : Gints naderden Juno daar men schatten door kunnen winnen , Zy hebben de Rykdom , en haar Iris aan haar zy ; en dit zijn Paris , die de schoon van de dry Den gouden Appel geest , daar trooijen door verbranden ."
251,"ik wraken de glans van 't licht , die toon my Plutoos stranden ."
252,"nu hebben gy , naar uw wensch , de Poel weêr in het gezigen , o groote toveres ! ik zijn aan u verpliggen : ik zullen u voeren daar de zwart spooken krielen : zelf daar hypsipyle , gevolgen van vrouwe ziel , die ik in de Afgrond braggen , voor Radamant zullen staan . Laat my van het gloeijend strand in uw veerboot gaan . nu zyt gy in myn boot , om over Styx te land : de baaren , die gy om de steeven heen zien branden , Zyn vol van zwavel , harst , salpeeter , pikken , en teer . Medea , houden u stil , ons naakt onstuimig weer . Wy nad'ren Plutoos Stad , ik zien de poort verschynen ."
253,"zien Cerberus , die stout zyn kop , vol fenynen , Afgryzelyk verheffen , tot noodweer van de poort : Zyn ooog zyn vol vuur , zyn klaauw graag naar moord : de hairen grimmelen vol Slangen , scherp van tand : Hy braken , nu gy hier komen , zyn gloeijen ingewand , door zyn drie keelen , om dat gy te rug zullen gaan ."
254,"ik durven , op hoop van hulp , het allerstout bestaan . vier tooneel ."
255,"wat zyt gy voor een vrouw , dat gy aan Styx komen stranden ?"
256,"ik komen uit Grieken , een de trouwelooste land ."
257,hoe komen gy dus bebloed in de onderaardsche Kolk ?
258,ik zijn om hals gebraggen van Jazons Oorlogsvolk .
259,"wat reden gaven gy hen , dat zy zich zo verstoren ?"
260,nooit hebben men reden om de vrouw te vermoorden .
261,een vrouw die zich vergrypt hebben tegen 't recht misdoen .
262,waar man rechter zyn kunnen 't vrouw volk niet bestaan .
263,"komen , nader , om uw naam en uw bedryf te ontvouwen ."
264,"ik zijn Hypsipyle , de koningin de vrouw , die de opperryk staf van heel Lemnos hebben zweien ; een Eiland dat euroop van Azien afscheid , in 't oog van Athos en de hard tracer stranden , waar dat Vulkaan zyn smits , die Etna tart in 't branden , Zyn aanbeelden van staal en gloeijende oven steldlen : Het landschap schudden en kraken , en daverden door 't geweld Der mookerslaag van zyn grofgeschonkte reus : als vader Jupiter , om het boos geslaggen te kneuzen , Zyn stompe schicht , vol vuurstraalen , vlam , vol staal en moord laten smeeden , komen hy uit zyn hooge zaal , tot roem van 't eiland , in Vulkanus smitsberg daalen . laten Kreeten met het graf van Jupiter trots praalen , Wy pronken , met groot recht , met ons gloende kolk . veel land zyn bekend , door de ondergang van 't volk ; maar Lemnos hebben haar saam , door kracht van kunst , genooten . de poort van de Afgrond worden door ons met grendelslooten en keten bezorgen voor Herk'les trots geweld . dies mogen ik gaan , met recht , in uw gelukkig Veld ."
265,Gy moeten ons reeden van uw gruuwzaam moord geeven .
266,"ik hebben nooit moord doen : maar al wie and'ren het leeven beroofden , hebben ik fel doen straf door het staal ."
267,"Gy hebben uw echt man ; in 't midden van de zaal , en al de vrouw die uit and're Gewesten op Lemnos kwaaam , eer gy uw bloeddorst lesten ! met haaar zoon vermoorden ! wat maken u zo verwoed ?"
268,"toen het steenig tracie , zo schelms als wreed van moed , ons volk , met grooter winst dan het haar door zee zien vaaren , beginnen het myn scheepen , die vol ryken waaren waaren , in spyt van het vreêverboud , te rooven door gevecht . een heiloos Land ontzien noch Zee noch havenrecht . wie zucht tot rooven hebben verbinden zich aan geen eeden . ons volk hier door getergt , en hart op 't hart getreeden , Begafzich endelyk , door nooddwang , in 't geweer . minerve grijpen noch nooit zo vaardig na haar speer , noch Mars naar het oorlogszwaard , noch Jupiter , ervaaren in het schicht werpen , toen zy al dwingen waaren Testryden met het heir de reus , grof van leên . Wy hehben het zwalped Nat al bruizende door sneên , en tracie , met magt van wapen , overvallen : de roover wierde diep in 't puin van haaar wal begraaaf , tot een schrik van al die zeên bevechten . een die rechtvaardig woed , bedienen getrouw het recht . te lesten keeren de vloot , vermoeid van man moord , met roof van vrouw en kind , tot ramp van Lemnos oord ; want deze vrouw , haar slaavin , maken al de man van ons Land , ô yinnig ongeval ! tot slaaaf van haar lusten , en telen end'lyk kind'ren , toen hebben wy de mans , om 't overspel te hind'ren , met hun by wyven en de zoon , dat haat'lyk zaad , op eene nacht verdelgen . nu weten gy het noodig kwaad ."
269,"hoe ! staan gy 't moord toe , daar gy straks tegen , blast ."
270,"neen , ik beek dat wy al de overspeelder sraffen ."
271,de straf op overspel mogen slechts by 't recht bestaan .
272,"ik zijn het hoofd van 't recht , en hebben hen recht doen ."
273,"echtbreeker staan te straf , maar niet van eigen vrouw ."
274,wie overspeelder straffen behoeven geen maat te houwen .
275,wie zonder oordeel straffen vervallen in 't zelfde kwaad .
276,de hand van een Vorstin gebruiken haar eigen raad .
277,wie wreken in schyn van straf worden zelf tot straf verweezen .
278,vorstin hebben voor geen hooger magt te vreezen .
279,"wie 't volk aan wet verpliggen , verpliggen zich zelf aan wet ."
280,een koningin worden nooit zo naauw een park opzetten .
281,het passen geen vrouw haar man de gorgel af te snyden .
282,wie fier zijn kunnen geen vreemd op haaar bedkoets lyden .
283,de bylust van een Vorst hebben in het Hof groot recht .
284,wie buiten het huuw'lyk mind vergrypt zich tegen de echt .
285,een die haar man vermoorden schend huuwelyk en leeven .
286,"wie Schelmen 't licht beroven , hebben geen geweld bedreeven ."
287,gehoorzaam ons gebod ; hier mogen geen twisten zyn .
288,daar 't recht gê reden lyd zijn 't recht geen meêr dan schyn .
289,een die beschuldigen worden behoren niet stout te spreeken .
290,een die zich vry bevinden behoren ook niet te smeeken .
291,weten gy wel wie hier zitten ?
292,weten gy wel wie hier staan ?
293,een die haar eigen man doen sneuv'len door verraad .
294,"waarom hebben gy de zoon , dat kind'ren zyn , doorsteek ?"
295,de kind'ren zyn gezind hun vader dood te wreeken .
296,eer kind'ren man zyn zijn al de staat herstellen .
297,een die zyn wraak ontveinst zijn starker dan 't geweld .
298,de wraak zijn door vernuft en tyd gedwee te maaken .
299,wie jong zyn leed verkroppen zullen oud aan het wreek raaken .
300,verjaren hevigheid verkrygen een koel moed .
301,de ontvonkte doovekool zijn overheet van gloed .
302,"Gy worden hier aanklagen , en zoeken ons op te houwen ."
303,"een wyze rechtbank zullen de zwak en brosse vrouw Altyd verschoonen , om haar teder natuur . de vrouw zyn te laf om het blaakeren vuur , dat in haar boezem leiden , door eigen kracht te lesschen : noch hebben het vuur meêr kracht in heerschen princes . de grooten zyn versterken , door 't voorrecht van hun staan . een vrouw zijn heten of koel , zy houden geen middelmaat . een aangebooren aard zijn qualyk te verzetten . de wet van natuur zyn de allerstark wet . zo gy myn zwakheid straffen zo worden natuur bestreên . al wie natuur bevecht betoond zyn heevigheên . een heevig rechter , moeten men het Rechterampt ontzeggen ."
304,"zullen een , die haar geweld natuur te last durven leggen de straf ontkoomen ? zo zullen een boosaardig wyf zich zinloos veinzen voor 't bestaan van 't boos bedryf . de straf verstrekken de deugd een overzeegbaar wapen . natuur zijn goed zo zich een mensch maar dragen rechtschaapen , zo eigenzinnigheid natuur niet hebben verkragt ."
305,"Gy steunen op uw geweld , en ik op myn geslacht ."
306,hoe willen gy datmen u na uw bedryf zullen hand'len ?
307,"'k willen in 't gelukkig Dal , vol myrtebossen , wand'len , By Prinssen , Koningen , Vorstinnen , groot van magt , En Helden , vol van moed , waar dat men dansen en lachen ."
308,"Gy moeten u naar ons recht , de wil van 't noodlot , voeg ."
309,"ik hebben doorgaans trachten om 't noodlot te vernoegen , en hebben het sterk bevel daar van altoos volbraggen ."
310,"Voort , brengen haar in 't vertrek , maar houden aan de uitgang wachten . hypsipyle betoond zich overwys te weezen ; Wy hebben voor haar Geest het allerkwaad te vreezen ; want zo zy al 't geheim van 't noodlot aan de schaar de ziel eens ontdekken , zijn de Afgrond in gevaar : Zy zullen ons , om vry te raaken , fel bestryden . het zullen best zyn dat men haar , om oproer te vermyden , in het vrolyk Veld doen gaan , zo vreesd zy voor geen pyn . wie wys willen Rechten moeten by wylen reklyk zyn ."
311,wie vrezen laten blyken worden zyn achtbaarheid benoomen .
312,"ik vrezen niet , maar ik zorg , om niet tot vrees te koomen . wie mêer willen dan hy kunnen gaan buiten zyn bestek ."
313,"het zijn raadzaam dat men haar ontbied uit ons vertrek , en van het Vergeetelnat in allerhaast laten proeven ."
314,"Voort , halen Hypsipyle , de tyd lyd geen vertoeven . Vyfde tooneel ."
315,"ik komen , op uw gebod ; hoe hebben gy u beraân ?"
316,"dat gy voor avond in 't gelukkig Veld zullen gaan . Wy willen u van dagen , uit gunst , genâ bewyzen ."
317,"Laat my voor deze dag , door de aard , in Grieken ryzen , om Jazons bruiloft te versteuren door myn schim ; Vergun my dit verzoek , op dat ik vaardig klimmen ."
318,"het worden u toestaan , om uw verleede Staaten ."
319,"nu zullen ik Jazon , die my trouw'loos hebben verlaaten , Bestooken op zyn feest , met een verstoren gemoed , en jaag zulk een angst , door de ad'ren , in zyn bloed , dat naberouw zyn hart afgrys'lyk bits zullen knaagen . een schelms geweeten kunnen men lichtlyk doen verzaagen . indien myn dit gelukken , dan zijn myn wraak voldoen . zes tooneel ."
320,"wat zyt gy voor een vrouw , dat ik u hier zien staan ?"
321,"het zijn Hypsipyle , die gy hier kundnen beschouwen , de recht koningin van Lemnos , ryk van vrouw . maar zeggen my wie gy zyt , die hier in het vleesch verschyn ?"
322,"Gy zien Medea , die van enk'le spyt verkwyn , om dat Kreüz van dagen met Jazon pogen te huuwen . ik komen om Proserpyn , daar ander voor gruuw , te bidden dat zy dit helpen stuiten door haar raad ."
323,"ik gaan na Jazon , die Medé , als my , verlaten , om hem zyn boos bedryf tot in het hart te drukken ."
324,Medea wenscht dat u deez ' aanslag mogen gelukken .
325,Hy zullen verzaagen als ik my by hem laten zien .
326,"hier komen Proserpina , ik zullen haar op myn kniên Ontmoeten , want ik hebben haar zo wel meêr bewoogen . haar Staatsy waag worden van Spooken voortgetoogen ; Zy hebben haar kroon op 't hoofd en ryksstaf in de hand . zeven tooneel ."
327,"WY zyn hier veer genoeg , die hond voor 't een stand . hier zwaaien ik met myn oog door de onderaardsche Kolken . laten Juno langs een vloet van blaauw turkooische wolk , vol held're star treen , ik wyk haar niet in magt : Zy zijn niet dan een lid van 't opperst geslaggen : ik mogen het heiloos volk naar myn gevoelen plaagen ."
328,o groote koningin ! ik knielen voor uw wagen .
329,"Medea , wat zijn dit ! wat jaagen u in ons Ryk ?"
330,de nood ; de groote nood !
331,"geven reden , of toon blyk ."
332,"Myn uitmergelen vel , myn natbetraande wang , en hairen , die gy heel door een verwarren zien hangen , Zyn blyken van myn nood , en het nypen van de smart ."
333,"laten een die het wreed gemoed , en het allerhardste hart doen sidd'ren , die de knots zullen Herkules ontwringen , en dwingen door Tovery , zich van een ander dwingen ? Voort , zeggen my wie het zijn daar gy vol pyn door leefd ."
334,"Gy weten dat Jazon my al lang verlaaten hebben , nu zoeken hy , door de trouw , zich by Kreüz te zetten ."
335,"kund gy dit Huuw'lyk door uw kunst niet beletten ? Voort span uw kracht in , zo volgen gy ons wet ."
336,ik hebben al wat ik kunnen gelyk te werk opzetten : maar alles zijn vergeefs op zyn verharden zin .
337,daar kunst vergeefs zijn moeten men met geweld beginnen .
338,wie met zyn starker stryd worden end'lyk neêr geleiden .
339,wie kunst en kracht ontbreken zoeken heil aan listigheid .
340,wie heil door list begeren moeten vyanden genaaken .
341,door veinzen kunnen men met zyn vyand vriendschap maaken .
342,veinzen vriendschap zijn by vyand verdenken .
343,wie wys kunnen veinzen hebben een ongemeene kracht .
344,wie eens bedrooog hebben zijn kwaalyk te betrouwen .
345,men wantrouwen slecht van mans : maar niet van zwak vrouw .
346,het veinzen van een vrouw hebben meenig man verraân .
347,wat willen gy dat ik doen ?
348,"dat gy my by komen staan . wie iemand helpen uit nood , kunnen hem aan zich verpligten . ik zweer by uw staf , daar duizend voor zwichten , By uw takken kroon , met paereel vereren , zelf by die naaar vloed daar Jupiter by zweerd , dat ik , zo gy my helpen , al staan ik in het midden van al ramp , u niet meêr om hulp zullen bidden ; Vorstin Proserpina , verhoor myn droef geklag ."
349,"ik zullen , o Voesterkind ! ik zullen op deze dag u helpen , eer Kreüz op het bruiloftsbed zullen treeden ."
350,"wie roem door hulp begeerd , betoond zyn mogentheden . Medea barst van spyt , zo zy geen hulp verwachten ."
351,"ik hebben drie stof van een overgroote kracht ; ja scherp stof met geen tong uit te schreeuwen , die , na het verloopen van ruim zes en twintig eeuw , met yzer , staal en loot , in 't woest legerveld zo woeden zullen , dat de mensch , door 't geweld de licht bliksemen , en zwaaar donderslaag , zelfs 't brullen ongediert , in bosschen , en in haag verschuilen moeten , om hun ongeval te ontgaan : de berg zullen door dit stof in stuk slaan , de Hooven morsselen , en tempeldaaak scheuren ; ja het zullen de Wallen uit haar diep grondvest beuren , en voeren , heel doormengen met mensch , door de lucht , dat hemel , aard en zee , door 't daveren gerucht , verschudden zullen , spyt haar onverwrikb're spil ; Jupyn zullen , op het geluit van huilen , schreeuwen , gillen , en donderen , verbazen van zyne zetel zien , en vraag of ' er , om de Waereld te gebiên , een nieuw Jupiter te trots hem komen braveeren : dan geven men deze stof , daar het oorlog by zullen zweeren , de naam van bussekruit , ja booskruit in de stryd ."
352,hoe dienen ik my hier van ? eizeg ! en op wat tyd .
353,"dit zullen geschieden dat geen oog 't geheim kunnen merken : ik hebben het ; om myn kunst op het krachtig uit te werken , geslooten in een kroon , die ik voor u opsluiten : toen vloeken ik driemaal met zo hees en schor geluid , dat my de hairen zelfs , door het gruuwzaam vloeken , reezen , de bitze Cerbrus , die voor onheil schijnen te vreezen , hebben driemaal , op myn vloek , door zyn drie keelen , naar en ysselyk blaffen , de lyvelooze schaar , beginnen te sidderen , en Pluto te bezwyken . gy zullen Kreüza , om uw gunst te doen blyken , de kroon toestieren , en doen zetten op haar hoofd ; zo worden haar leeven , als het goud haar raken , beroven : want dit verburge vuur zullen op haar pruik ontsteeken . een die zich wreeken willen moeten zich op 't zekers wreek ."
354,met welk een dankbaarheid zullen ik uw groote gunst genaaak ? o godin ! waar blyft de kroon vol kunst ? Myn zin schynen door 't vertoeven te verwarren .
355,"Myn vlug kamerboô , het zijn geen tyd van mar , gaan in myn Kunstvertrek en halen myn koop're doos ."
356,een enkel oogenblik schynt my een lang poos . waar blyft de kroon ? waar zijn .....
357,"staak , staken uw heten verlangen . komen , volgen my ; want gy zullen de kroon van my ontfang , en zeegevuuren eer de zon de lucht verlaten ."
358,"Myn heil beslaan alleen in het vord'ren van de daad . vertooning na het drie Bedryf . neptuin , Saturnus zoon , met wit besneeuwde haaren , stoken met zyn drietandt op de onmeetelyke baaren , Hy staan by Amfitriet ' , het doelwit van zyn min , die met haar Dolfyn hem geduurig leggen in 't zin ; Terwyl de Tritons met Kinkhoorenen trompet , om zyn gevrezen gezag in hooog top te zetten ; najade juichen op dat schateren geluid , waar van de galm op rots , en berg en strand stuiten . eöol , de grootvorst van de worstelen wind , laten zich met zyn gevolg by deez ' byeenkomst vinden . al de element staan , op vrouw Medeaas beê , dienstvaardig ; zy beweegen , en Aarde en wind en zee , om Kreons hof , door vuur , uit de onderaardsche hoolen , door Eölus geweld , te zien in gloênde koolen . de rustelooze wraak , die staal en steen verteerdt , zijn nooit verzaadigd , voor zy het al zien omkeren ."
359,vier bedryf . een tooneel .
360,"O Groote Hecate ! Vorstin de naare kolk , die op uw yz're troon , omheint met zwart volk , uw koop're Ryksstaf zwaaid , bestier uw toverkracht , ik zullen , tot dankbaarheid , in 't naar van de nacht , recht op een driesprong , een driekant steen oprecht , en naad'ren dit autaar met ongevlochte vlecht ; met merk van wolleven , en slibb'rig ingewand van jong kind'ren , dat ik , met deze hand , rukken hebben uit haar borst , om u te vreên te stellen : dan zullen ik , met een boek , bereid van maagdevel , gezang zingen , die met bloed geschreeven zyn ; de hoor van een stier , vullen met scherp fenyn van een verwoed draad , voor offerkelk gebruiken ; en 't doodshoofd van een leeuw , vol branden ybestruik . voor zwaaijend wierook vat , die sterk my in myn wrok : 'k zullen Jazons bekkeneel uithollen tot een klok , en Kreons mergschenken in het hol voor klepel hechten , Kreüzaas zenuw en darm zaaam vlecht , om de opgehange klok te kleppen met die koord : ik wachten op deze klank de roodverven moord , de rustelooze Twist , een pest voor volk en staaten ; het toomeloos geweld , gespen in harnasplaaten ; de looze Veinzery , en wraak , vol bloed en gal : dan zullen ik driemaal , met dit schrikkelyk getal , om het blaakend Autaar gaan , vol mensch ongeltoortzen ; ja driemaal knielen , met een siddering van koortzen , en driemaal schreeuwen , met zo overgroot een kracht , dat hemel , aard , en zee , tot schrik van het aardsch geslacht , weêrgalmen zullen ; die versterken my in myn lijen , laten uw Dochteren , de fel razernij , door de aard ' heen breeken , om Medea hulp te biên ; ik horen de kroon alreê by Jazons bruid te zien . Twede tooneel ."
361,o Overblyde staan ! o overdroefbeveelen !
362,"hoe ! blyde en droef gelyk , hoe kundnen gy dit verdeelen ?"
363,ik hebben uw kind gekreegen uit het hof .
364,"o Voester ! ik beek , dit zijn een blyde stof : maar laten my hoor wat tot droefheid kunnen verstrekken ."
365,"Kreüza willen dat gy , o droefheid ! zullen vertrekken ."
366,"dat zijn een order die my niet dan blydschap baard : Korinten noch dit Ryk zyn myn verblyf nier waard . hebben gy de kroon bestellen , om Jazons bruid te smooren ?"
367,"dat zullen zo voort geschiên , de tyd zijn eerst geboor : want Jazon en Kreüz zyn vaardig om te gaan naar het huuwelyks Autaar : u kunnen geen wraak onstaan ."
368,"o vader Jupiter ! beschermer al Grooten ; o Juno Schatvoogdes ! en band de echtgenooten ; en gy , ô Venus ! die het hard hart doorwond ; o gy , getuige van ons huuwelyksverbond ! vergun dat ik Kreüz , door list , in de aard doen duiken . wie zwak en wys zijn moeten bedekken geweld gebruiken . het sterven van Kreüz zullen my een leeven zyn : 't verbranden van het Hof een held're zonneschyn : ja Jazons kermen zullen Medé tot vreugd gedijen . o Huuw'lyks Voogden en Voogdessen ! help my strijen : vergeven Medea zo zy zich niet vinnig wreken ."
369,"hier komen het Hof , het zijn best , dat gy u voort versteken . drie tooneel ."
370,"HIer staan drie troonen , om uw huuwelyk te vieren , elk draagd een Autaar , rood van 't bloed de offerdier : dat pronken voor Juno , die de Huiszorg gâ leerd slaan : dat blaken voor Venus , daar de liefde voor moeten staan ; en dat voor Pallas , die de wysheid voor komen draagen , drie Zuilen , die het gewelf van het huuw'lyk onderschraagen : want zonder zulk een steun vervallen het echtgebouw . Voort , brengen de duif tot een voorbeeld van de trouw . getrouwde moeten als paren duif weezen . men offer hier geen gal , of u staan twist te vreezen ; het zijn heilloos als de Twist in 't huis van het huuw'lyk brullen . Geef my de goude Kelk , met zoet mee vullen , doormengen met zerpe wyn , om 't walgen te verhoeden . zo mengden men in de trouw de voor met tegenspoeden ."
371,nu vrezen ik geen medé .
372,die zijn al lang in 't schip .
373,ik wensch dat zy haar kiel mogen mors'len op een klip .
374,"ach ! ach ! Medea , ach !"
375,wat hebben Medé bedreeven ?
376,"Zy hebben haar geest , helaas ! zo daadelyk gegeeven ."
377,hoe ! zijn Medea dood ? zo leven ik buiten druk .
378,hoe komen zy aan haar dood ? verhaal ons het heele stuk .
379,"met dat myn voesterkind haar kind'ren hebben ontfangen , hebben zy haar voort omhelzen , en kussen mond en wang . het moederlyke hart hebben zucht tot eigen zaad . Zy schenken u deze kroon , haar moeder hoofdsieraad : maar toen zy docht dat zy moeten zwerven op de baaren , slaan zy de vinger , dol van gramschap , in haar hairen , de vuist voor haar borst , en nagel in 't gezicht ; te lesten greepze een zwaard , zo scherp gelyk een schicht , dat zy tot driemaal op haar bloote boezem zetten : tot driemaal toe komen ik haar wreede hand beletten : maar end'lyk dompelden ' zy het snyden zwaard , ô smart ! tot aan 't gevest toe in de bloedbron van haar hart . in 't vallen scheenz ' haar zaad erbarmlyk te beöogen ; De dood zijn dwars door 't bloed te moordwond ingevlooog , en dreef'er leeven , dat het hart bewonen , weêr uit . haar kind'ren schreiden , met een deerelyk geluit , en mengen het schuimen bloed met biggelen traaan ."
380,waar zijn het koud Lyk ?
381,het leiden in de ype laanen .
382,"Voort , brengen de kind'ren hier , en berg het Lyk op 't land ."
383,"ontfang de kroon , ô bruid ! van de oud voester hand . dit zijn haar laat willen , voor de uitgang van haar leeven . de wil van een die sterven behoren men plaats te geeven ."
384,"ik zetten de kroon op 't hoofd , vol flonk'ren Diamant ."
385,het gesteent verwachten op 't hoofd een leevendig brand .
386,"o Juno ! Echtvoogdin , verschyn ons met uw reijen ; laten Hymen , bruiloftsgod , zyn held're fakkel zweijen ."
387,het zijn tyd dat ik vertrek eer 't vuur zich openbaaren .
388,"o Huuw'lyks Vorsten , en Vorstinnen ! mild van aard , begunstigen deze trouw met uw ry zeegen . wie met het autaar begind , betreed geen slinkze weegen ."
389,vrouw Junoos Pronkbeeld lachen met de ooog vol van glans .
390,"op , wakk're Dansschaar , op , vertoon de Bruiloftsdans ."
391,"ik zien hier daald een Kloot , met wolk overtooog ."
