turn,text
392,"de geest van Korint betoonen hun vermooog , om Jazons huwelyk te looven na waardy . daar opend zich de Kloot en toond een Schildery van zeven starren , die door het blaauw gewelfzel zweeven : de gunst van dit gestarnt betekenen heilzaam leeven ."
393,"hier zijn noch kunst , noch zweet in deze dansen sparen ."
394,"o Huuwlyks Voogden , en Voogdessen ! mild van aard ' , begunstigen deze trouw met uw ry zeeken . wie met het Autaar beginnen betreed geen slinkze weegen ."
395,Wy danken de Offeraar voor 't vieren van de trouw .
396,"wat horen ik voor gedruis ? het kerkelyk gebouw beginnen te dreunen , ja te kraaken en te scheuren : de slooten , keten en de grendel , die de deur Van Junoos Hoofdkapel bezorgen , slaan geluien ."
397,"wat spook , helaas ! wat spook ! doofd de offerhand uit ? de wolk barsten op , en braaak bliksemstraalen en donderklooten : sluiten , ô lucht ! ei ! sluiten uw zaalen . vier tooneel ."
398,"OCh ! huuuw'lyks priester , och !"
399,hoe zyt gy dus ontsteld ?
400,"ik zien een zee van bloed : de lucht zijn vol geweld : de marm're beeld zien men warm traaan weenen : men horen de Kind'ren in haar moeder lichchaam steenen ; de hond janken naar , en barst schichtig los : De Wolven koomen uit het naast geleege bosch , en raken en op de markt afgryzelyk aan het huylen : het grimmeld in de lucht van havikken en uil : de grond hebben , driemaal na elkaâr , van angst , gezucht , en scheuren wyt van een met onverwacht gerucht , en braken spooken , die met adder zyn behangen : het krield door al de stad van kronkelen Slangen , die gruuwzaam blazen in het oor van de onderdaân : men zien in de ope lucht veel wonderteken staan : de bang Burgers horen men zuchten , kermen klaagen . in deze ontsteltenis vertonen zich een waagen met draaak in de lucht , waar dat medé op zitten : in haaar slink hand hebben zy de toom vatten , en in de recht een roê : het zijn schrikk'lyk in het vertoogen ."
401,"de Voester , hebben , ô spyt ! het heele Hof bedroogen ."
402,"men knielden op de aarde op dat het onheil weêr bedaren . o Huuwlyks Vorsten , en Vorstinnen ! mild van aard , begunstigen deze trouw met uw ry zeegen . wie met het autaar begind betreed geen slinkze weegen ."
403,"helpen , Jazon , Jazon , helpen ! ik zijn in droef stant ."
404,"wat deeren , myn waarde Bruid ?"
405,"Myn vlecht zyn aan brand . betoon , dat bidden ik u , betoon aan my uw pligte ."
406,ik zullen de goude kroon van uw hairen lichten .
407,"laten staan , ik bidden ! laten staan , de kroon zijn veel te vast : Gy doed my , nu gy trekken , een dood'lyk over last ."
408,"wat Wonder zien men hier ! de kroon beginnen te ontvonken . Medea hebben het vuur , uit Plutoos nachtspelonk , ik deze kroon gebraggen , tot weerwraak van haar leed ."
409,"och ! berg my in 't vertrek , om 't vuur , zo fel als heten , door kunst , te lesschen , eer de vlam hooger blaaken . Vyfde tooneel ."
410,"gehaate Griek , houden stand ."
411,wie komen my hier genaaken ?
412,"verraader , valsch schelm , die elk in boosheid tarren , draaien uw gezichtstraal om , en zien tot in uw hart , daar zullen gy leezen , dat ik hier om wraak komen zweeven . elk mensch vinden zyn bedryf in 't blad van 't hart geschreeven : het geweeten houden ' er boek , van al kwaad bemorsen . Voort open de gordyn van uw verwoed borst . dat heilloos moordhol , vol van bloedig tooneelen , Gy zullen ' er het boos bedrog haar valsch rol zien speelen , Gevolgt van trouwloosheid , en het afbranden gemoed . Gy zyt , als uw Kreüz , smoordronken van myn bloed , en haken noch om uw balg vol bruiloft wyn te zwelgen . hoe ! schrikken gy voor myn schim , en dorst gy het lyf verdelgen ? Gy zoeken uw heil vergeefs in schaduuw van dit dak . Myn fakkel , die ik aan het vuur de wraak ontsteken , zullen u een bruiloftstoorts , die vinnig blaken , verstrekken , de vlam die uw Kreüz het hoofd begind te lekken , zijn het lykvuur dat haar heel tot asch verteeren zullen ."
413,waar berg ik my van angst ? o onverwacht geval !
414,"Gy vinden geen zekerheid al gaan gy u verschuilen op hemelhoog gebergen in diep zinken kuil , langs golf zonder strand , en bosschen dicht van blaân . de gramschap van de wraak zijn door geen vlugt te ontgaan . ik zullen uw ziel , als zy het lichchaam hebben begeeven , met myn ontsteken toorts tot in de Poel naarstreeven , en daag u daar voor de Vierschaar van dat Ryk . wee , Trouwelooze , wee ! dat ik dit Hof ontwyk , zijn om Medea , die naar wraak staan , plaats te maaken . zes tooneel ."
415,wat moordgeschreeuw vervullen de koningly daaken ? ik ly geen onheil in de tempel van myn Hof . een blyde bruiloftsdag gedogen geen droef stof . wat zijn ' er gaans ? zeggen op : wat ramp komen u verdrukken ?
416,"Medea hebben , ô ramp ! o gruuwlyk ongeluk ...."
417,"wat hebben Medea , zeggen , wat hebben zy hier bestaan ?"
418,"Myn bruid zijn door de kroon , die zy haar schenken , verraân : want al de tak zyn vol heete toverij ."
419,"helpen ! vader , vader , helpen ! uw dochter zijn in lijen : de vlam verteren myn bloed , en knaagd naar het ingewand ."
420,"helpen ! kreon , Kreon , helpen ! Kreüza zijn vol brand , en 't vuur dat haar verslind verspreiden zich door de zaalen ."
421,"Voort , laten ons 't ongeval door wakkerheid bepaalen ."
422,ik sluiten de tempel voor een grooter ongeluk .
423,"op ! lyftrouwant , op ! en helpen my uit myn druk ; begeven u in de yl gewapend naar de scheepen , eer dat de voester vlucht , gy moeten haar herwaards sleepen , maar houden haar streng boeien . wie een doodschuldig man laten slip uit zyn hand , als hy hem houden kunnen , verdienen geen minder straf dan die de straf ontloopen . zeven tooneel ."
424,"verwaande Griek , houden stand , gy hoeven niet eens te hoopen dat uw Vyandin met keten worden prangen : sla uw gezicht om hoog , Medeaas waag hangen in 't midden van de lucht : hier daald zy met haar kind'ren ."
425,ik zullen u met myn zwaard ....
426,"staan , af , of't zullen u hinderen ; zo gy my dreigen durven zo zyt gy roereloos . dat ik geweek zijn zijn voor een kort poos . wie wissen willen wreeken eischt eerst tyd om rijden te weezen . een die zyn Ega wraken hebben al kwaad te vreezen . uw trouwelooze trouw verwachten geen and're zaak ."
427,ik bidden u om genaâ .
428,ik zijn te heten naar wraak .
429,"ik bidden , ô groote vrouw ! ik bidden u , om myn zoonen ."
430,"uw bidden diend om my op het schandelyk te hoonen ; zo lang als gy my bidden plegen ik geen weder wraak : dit zijn voor my , ik zweren het een haatelyke zaak . wie wraak willen pleegen moeten zyn vyand fel bezoeken . Gy bidden my ; maar als gy my vinnig zullen vervloeken : zullen ik gelooven dat myn wraak zich wyt verspreiden : nu vloek ik vinnig op myn eige laffigheid ."
431,"ween ! Grieken , Grieken , wenen ! Kreüza zijn verslonnen ."
432,"lach ! Kolchos , Kolchos , lach ! myn weêrwraak zijn beginnen , ik hebben door moord van myn allerjongst Broêr , op Pontus meir leren , dat ik op Kreons vloer , uw haatelyke zoon , al lachen , durven verdelgen ."
433,"zo gy , o wreede vrouw ! uw balg vol bloed willen zwelgen , zo openen deze borst daar manlyk bloed in zitten ."
434,"ik willen niet dat gy sterven ; ik hebben een ander wit : ik willen dat gy noch lang in myn gezicht zullen leeven . ja die uw leeven dreigden zullen ik de doodsteek geeven : doch het leeven worden u niet van my uit zucht gunnen : maar om dat gy zullen zien , hoe deze hand , de punt Van het lemmer stooten zullen in uw kind'ren hart . dit leeven zullen u meêr dan duizend dooden smart , om dat gy uw zoon meêr dan u zelfs beminnen maar hebben gy uw zoon zo vuurig niet bezind . dan zullen ik u in 't oog van uw zoon doorsteeken . een die zich wreeken willen moeten zich op 't fel wreek ."
435,"uw boezem worden , o schrik ! van wreed gedrogt bewonen ."
436,"My passen zo wreed een aard , want ik worden wreed honen ."
437,de Faam zijn krachteloos om uw bedryfte mellen .
438,"indien de Faam myn wraak niet hoog te toon willen stellen , zullen ik myn eigen gal doormengen met het bloed van dit vervloeken paar , en schryf hoe verwoed ik my gewrooken hebben aan Jazons trouwloosheden ; zo zullen nooit man zyn vrouw zo tegen 't recht vertreeden de Uitheemsche worden in Korinten recht ontzeid ."
439,worden u het hart niet week nu dat uw Jazon schreid ?
440,door traaan worden het week al waar het omheint van steenen ; maar gy verharden myn hart : neen ! ik lach om uw weenen .
441,hoe ! lachen gy nu ik wenen ? ô smaad ! o smart ! o pyn !
442,"zo gy aan het lachchen raken , zullen ik aan het weenen zyn ; want tusschen u en my kunnen geen verzoening weezen : zo ik met u verzoen zo schyn ik u te vreezen . bevreesd te heeten zijn een lydelooze hoon : ik zullen , om deze naam te ontgaan , my zelve doôn ."
443,ach ! al myn luisteren worden hier op een tyd verslonnen .
444,"als uw roem , door my , op het Aardryk zijn verwinnen , zo klimmen ik ver op , door al de star heen , langs 't spoor dat Herkules zeeghaftig hebben betreên , om Argos , uw Schip , vol tintelen star , geduurig in een wolk van nacht te verwarren ; zo worden uw roem om hoog als hier om laag verdoven : dan zullen ik , dit staan vast , schoon het Jazon niet geloven , Myn vlot waag in de plaats van Argos plant , en dicht bezaaijen met gestarnde diamant , die heller flonkeren , dan 't zonlicht zich laten zien : indien de hemelleeuw myn toeleg willen verbiên , zullen hy myn kracht , spyt zyn klaauw en tand , voelen ; en pogen de Waterman myn kracht te verkoelen , zo domp'len wy hem in zyn eigen watervloên . ik zullen , zo het noodig zijn , het scherp Scorpioen , de Steenbok , Ram en Stier , afgryzelyk in het stooten , en schaaren van de kreeft , op het allerfel onslooten , Stomp maaak , door de kracht van schrander Toverdicht . de Schutter moeten zyn buigen ontspannen , en zyn schicht verbranden in het vuur dat my van wraak doen blaaken . wie dapper weêrstand bieden kunnen zich ontzachlyk maaken . de Visschen , Twelingen , de schaal en maagd , vol pracht , bezwyken voor myn komst : zo worden , door myn kracht , de Twaalef Teekenen op het Zonnespoor binden . ik zullen de hals van de flikkerende hond en bitze Beeren , die by het Noorder aspunt staan , aan keten sluiten , en heel kort aan band doen gaan . Orion zullen zyn zwaard vergeefs tot woeden wet . ik leven alleen om uw vermooog te verpletten ; dat dit de waarheid zijn zullen ik u voort doen zien ."
445,de spyt doorsnyd myn hart . laten reden u gebiên .
446,"uw spyt zijn veel te kleen ; die moeten ik hooger draaven . ik zullen , om u meêr spyt te doen , een van uw slaaaf verkiezen tot myn Boel , en op uw ledikant doen hoonen , dat gy het zien : in 't blussen van myn brand , zullen ik , tot spyt van u , uw trouwloosheid verwyt : ik schroom geen vuil bedryf , als ik u al de spyt , die al de mensch t'zaam bestormen , weten te doen ; en zo myn overspel u spyt weten aan te voên ; zo spyt my dat ik u niet eer met spyt komen kwellen ."
447,ik zweren dat ik my weêr by u als man zullen stellen .
448,"verwaand en boos gedrocht , verkroppen van schelmery , ik zweren dat ik my zelf verfoeien , zo ik dit ly : Myn oor zyn besmetten door u te hoor smeeken : Myn mond hebben straf verdienen dat zy met u durven spreeken ; Myn ooog zyn verbeuren dat zy u durven zien , zo my de Wraak niet straffen , nu zy dit zien geschiên , behoren men haar , als een die pligt vergeten , te straffen ."
449,"ik bidden , Medé , ik bidden ..."
450,de moord zullen ze u beschaffen .
451,ach ! geven myn kind : horen hoe uw Jazon vleid .
452,daar zyn uw kind'ren : zijn Jazon nu peien ?
453,"ik horen , helaas ! ik horen haar bekkeneelen kraaken ."
454,"nu vliegen ik met myn koets , die van twee vlug draaak worden door de lucht voeren , naar een gewenscht ' er land . acht tooneel ."
455,"wie zien ooit kind'ren van haar eigen moeder hand , o gadelooze moord ! zo onverzoenlyk kneuzen ? O Groote Jupiter ! hebben gy het heir de reus , om hun vermetelheid , met berg overdekken , Gy worden door dit bedryf , tot straf opgewekt : of weten gy tot dit kwaad geen straftuig uit te vinden , zo ruk de bliksemen , moorddonder , woest wind , Slagregens , haagelen , aardbeeving , en al wat schenden kunnen , by een , en storm overval . Medea , waar zy vlucht met haaar helsch waag . een die zyn zoon vermoorden verdienen de zwaar plaag . negen tooneel ."
456,"verzetten uw ongeval , ô prins ! zo wyt vermaard ."
457,"och ! och ! myn Zoonen , och ! gy storten hier op de aard ; maar ploften op myn borst , om 't hart tot wraak te wet : dit zyn , o schrik ! dit zyn Likaöns moordbanket . Gy brakken uw leeden door de val , o bitt're smart ! maar het breeken van uw leên breken vaders moedig hart . Gy zwemd in rooken bloed , en ik in brak plas . wat voor een winterstroom durven uw lent verrassen ? zo worden het ooft , eer dat het ryp zijn , afplukken ; Medé hebben my met u gelyk in 't graf rukken . daar wyn moeten vloeijen , zien ik bloed en traaan leeken : ik wensch myn leeven te verdrinken in de beek , om by de schim van myn kind te gaan . de kind're zucht hebben magt om alles uit te staan . waar zien het aardryk ooit het bloed van kind'ren plengen ? ik zullen uw bloed , o zoon ! met vader bloed doormengen ; Myn boezem zijn gereed , waar zijn het scherp zwaard ?"
458,"grootmoedig prins , houden stand , en toon een dapper aard ."
459,"wie 't lief leeven mind , ik moeten de dood beminnen ."
460,een die zich zelf vermoorden betoond zich zonder zin .
461,ik walgen van het leeven : want ik zwemmen in tegenspoed .
462,wie zich om rampspoed dood ontbreken een heldemoed .
463,een hart dat sterven kunnen behoefd geen ramp te wachten .
464,een die zyn ramp verzet hebben ongemeene kracht .
465,hier zyn myn kind'ren van Medeaas hand doden .
466,"wat gruuwel zien ik hier ? op , Jazon , op ! doorstoot Medea , zo zullen gy u op het vaardig wreeken . men mogen zyn vyand , maar zich zelve niet doorsteeken . een die zyn vyand dood worden leevendig verbreiden . tien tooneel ."
467,"zie hier , ô prins ! zien hier , waar uw Kreüza leiden : haar lykbed hoeven niet voor haar bruiloftsbed te zwichten ."
468,"Gy hebben haar bed versieren met tallelooze licht : maar 't licht van haaar glans zijn van de dood beroven . Zy plukken in haaar lent te wrang een herrefst ooft . ik vinden hier lyksipres in plaats van bruilofts roozen . men dissen hier bitt're gal voor nektar en ambrooze . uw trouw-en sterven uur zyn te dicht by een stellen . O ongenadig lot ! ô doodelyk geweld ! medé hebben u te wreed , door haar geweld , doen sneeven ! haar gift zijn vol vergift , haar geeven zijn vergeeven . het vuur dat u ontsteken ontsteken my hart tot wraak ,"
469,"bedroeven Bruidegom , wy zullen uwezaak ...."
470,"ween ! Zoonen , Zoonen , wenen ! storten duizend oceaaan , nu dat uw vader wenen , van zieden heete traanen , en laten ons bruisschen , door de zwallepen vloên , naar het Elizeesche Veld ; ik vrezen geen tegenspoên : Wy zullen ons in 't schip van Goedehoop begeeven : de zeil , zyn , door min , van zuchten t'zaam geweeven : De zorg zullen het dieploot zyn , en wakkerheid 't kompas , de liefde staan by 't roer , om 't Schip naar 't hels moeras te stier , door de zeen , die uit ons ooog leeken : de balglast die het voerd , zyn klagt , kermen , smeek , en zuchten , om op zee niet om te kunnen slaan : Kreüza zijn de Star daar 't Schip op aan moeten gaan : ik willen , met haar , van dagen , by Pluto bruiloft houwen . waar heen ? wy zyn te veer , stryk 't zeil of het zullen u rouwen ; maar blussen kreüzaas vuur , zo redden gy haar uit nood ."
471,"bedaar , ô prins ! bedaar ! want uw Kreüze zijn dood . wie hoog willen klimmen zullen veel ongeval genaaken . de ramp dringen veel in koninglyke daaak . Fortuin vernoegen zich niet in huis laag van stant ."
472,"maken plaats ! ik zeggen , maken plaats ! of gy zullen van myn hand .... wat horen ik voor geluid ? ach ! ach ! het zyn myn zoonen . hoe ! roepen gy my tot hulp ? ik zullen uw hulp betoonen ; Myn kracht zyn gereed . wie roepen my daar van var ? zyt gy het , myn fier bruid ? ik komen , myn Morgenstar ; ik komen , myn Middagzon , ik zullen u daad'lyk trouwen ."
473,"op , hoveling , op ! en helpen de koning houwen : Hy trekken zyn hairen uit van enkel ongenucht ."
474,"laten los , noch eens , laten los ! eer dat Medea vluchten . Elfde tooneel ."
475,wie komen hier naderen ?
476,wie dwingd my hier te spreeken ?
477,de Groote Jupiter .
478,zo hebben ik stof tot wreek : want myn Kreüza zijn te schandelyk verraân .
479,"Myn Koning , zyt gerust , zo gy na wraak willen staan , hier zien gy Jazon zelfs , en heel tot wraak geneegen ."
480,Zyt gy tot wraak gezind ? ik zijn om hulp verleegen .
481,"Voort , wys de Toveres , zo hebben myn gramschap werk ."
482,Zy zijn met haar Karros gereeden door het zwerk .
483,"laten ons de heuvel , steenklip , berg , duin en tooren , zwaar van stof , met hemelhooge kruin , Voort op elkanderen gaan staap'len naar de lucht , en steig'ren door het gestarnen , zo stuiten men ze in haar vlugt ."
484,"ik zullen het slagzwaard van de wederwraak aanbinden , en vaardig vliegen , met de vleugel van de wind , tot binnen in de Maan , om in de Waereldkloot ; die zich , tot noch toe , in haar waterig schoot , voor ons gezigen verschuilen , Medea te achterhaalen , en zo die waereldkloot , vol bosschen , berg , daalen , Hoofdsteeden , stroom , en zeên , zich tegen my aankant , zullen ik haar , door het vuur , dat my van gramschap brand , ontsteek , om Medé tot asch te doen verteeren . Voort , starke wind , voort , en neemd my op uw veeren . Twaalfde tooneel ."
485,"HA , ha , ha , ha , ha , ha ."
486,ik horen Medeaas stem .
487,"ha , ha , ha , ha , ha , ha ."
488,zo zijn zy in de klem .
489,waar zijn myn Vyandin ?
490,in 't hoog van de wolk .
491,"waar zyt gy , in wat oord ?"
492,in 't diep de naare kolk .
493,eerst boven in de lucht ? nu in het helsch Dal .
494,"Medea , die gy zoeken , vertonen zich overal ."
495,"ik zullen u overal , wapenen , tegentreeden ."
496,"Medeaas toverkunst belacht uw moedigheid . wie volgen willen die volgen , ik wyk uit deze Wyk : ik vliegen na boven en beneden te gelyk ."
497,"ik klimmen voort opwaarts , om dit schrikdier na te speuren ."
498,"ik zullen het Aardryk , door myn stampen , op doen scheuren , en ylen , als alcid , naar de Afgrond van de dood , en stappen , vol van moed , in spyt van Charons boot , dwars over al de vloên , van de eeuwig duister oord : hier zullen ik in 't gezicht van Cerbrus , heten op moorden , de helsch poort voort oprammen met myn knots , zo zullen ik , vol van wraak , in de onderaardsche rots , door spooken , ziel , vuur en zwavel vlam streeven . wie overwinnen willen moeten zich in nood begeeven . scheur , Aardryk , scheur van een door 't stampen van myn voet . nu zullen ik haar , want de aard ontsluiten , uit de afgronds Vloed , Geketent sleepen , om aan het grieksch volk te geeven ."
499,"hoe lang , helaas ! zullen noch Medé Korint doen beeven ? ik volgen de vorst , tot een steun voor ongeval . door hulp van het priesterdom behoud men 't lang stal ."
500,Vyfde bedryf . een tooneel .
501,"GY hebben my lang verzoeken dat ik met u zullen daalen in koning Kreons Ryk , hier zyn wy in zyn paalen : en , voor het heele Hof , door ons zorg , bedekken . wat zyn de reeden dat gy my in Grieken trekken ?"
502,"nu Jazon en Kreüz , door de echteband , verëeen , Behooren wy dit paar de zeege te verleenen . de Trouw de grooten dienst tot welsland van de staat ."
503,dit Huuwlyk worden van my op het allerfel haten . want Jazon hebben zyn trouw tot tweemaal toe ontbinden . een die zyn trouw ontbind hebben junoos recht schenden . wie 't recht van het huuwlyk schend verachten de gunst de Goôn . Tweede tooneel .
504,"wat jagen u herwaarts aan , zeggen , Majaas vlug zoon ? ik komen uit Kreons Hof met schrikkelyke zaaak ."
505,"laten hooren wat gy brengen , het zullen ons konnen raaak ."
506,"toen Jazon met Kreüz voor het autaar worden trouwen . ontfing zy op haar hoofd een kroon van louter goud , die haar Medea , door haar voester , doen vereeren : maar deze kroon zijn , door haar toveren en zweeren , vol doodlyk vuur gebragt ; dat op haar hoofd ontsteken : nu vliegen de vlam verwoed in het uitgespannen dak , en knagen , met haar scherp en gloeijen heete tand , de zuil , weltzel , vloêr , en dicht bemaalde wand , tot aan het binnenst toe van de opgesteege muur , om alles in haar balg , vol van verslinden vuur , dat staâg naar voedzel haken , heel gulzig in te zwelgen . de vlam weten staal en kooper te verdelgen . nu hoord men een geschreeuw dat aan de star stuiten . het Burgerkrygshoofd vliegen verbazen , op het moordgeluid , met wapen in de vuist , naar de afgesteege wal , wat vyand willen , roepen hy , korinten overvallen , het vrouwenheir zijn dood , ik staan voor stad en Staat . de wakkerheid behoeden de steeden voor verraad . hier op zien hy het Hof gelyk een branden oven . Hy zoeken Vulkanus door Neptunus uit te dooven . het heele Hof gelijken een eeuwig gloên kolk . de binnentrans zijn vol van allerleije volk , maar het zien geen uitkomst door het overschichtig branden ; het kloppen voor de borst ; het wringen van de hand , het trekken by het hair , noch het weenen doen geen nut . de bron wierde , om te lessen , leeg putten . maar 't Hof hebben door het nat in 't weinig geen hulp genooten : het zijn of zy branden pik in gloeijende oly gooten , doormengen met zwavel , herst , zalpeter en herpuis . de wind blazen , om het koninklyke Huis te schenden , in het vuur , dat alles komen verdeilen . de man schreeuwen , maar om nat maken zeil , maar 't schreeuwen zijn vergeefs , met hebben zich niet verzien . de vrouw schooten toe , om 't vuur het hoofd te biên , de Praalgewaaden , die zy nat van traaan maken : Deez ' bragthaar keurssen , die van held're steenen blaken : zulk een tapyten , vol van beeld , schoon van verf ; een ander sluijer , op het kunstig , van Minerf , vol paerlen borduren , om 't hout van 't dak te omvatten . het parssen van de nood ontzien noch kunst noch schatten . de wolk wierde veel bedekken met rook en stof . toen Phebus zyn gezicht laten daalen op het Hof , ontzetten hy van schrik , zyn luisteren schijnen zinken ; hoe ! durven gy my , roepen hy , met uw verwoed vonk en vlam , bestormen op myn waag van robyn : dat zullen u missen : want ik zullen ' er tegen zyn . een die al de aard verlichten willen zich niet laaten hoonen . wie magtig zijn behoren zyn mogentheid te toonen . Wy lyden gloed noch rieken voor ons Zonneschyn . zo roepen Apollo , en hy vatten een gordyn van duizend wolk , en hy schuiven het voor zyn straalen : hier op zien ik een nacht zo dik en duister daalen , of al de nacht t'zaam vergaderen by een . de duisterheid , die staâg de naaar schrik'lykheên bemantelen met haar kleed , ontdekken hier de naarheid ."
507,in duisternis vertonen de brand de meest klaarheid .
508,het verhaalen van de brand hebben my het hart doorwond .
509,hoe gaan het met al 't volk dat op de transsen staan ?
